,title,subreddit,neg,neu,pos,compound
499,Biden readying new sanctions on Russia over Nord Stream 2 pipeline,1,0.0,1.0,0.0,0.0
500,"'It's wrong, it's un-American and it must stop': President Biden denounces attacks against Asian Americans",1,0.426,0.574,0.0,-0.836
501,Biden Team Engaged in ‘Rigorous’ Debate Over Ending Forever War,1,0.267,0.548,0.185,-0.296
502,Biden must persuade Germany and Austria to stop the “Schroederization” of Europe [Atlantic Council],1,0.145,0.855,0.0,-0.296
503,President Biden Takes 1st Tentative Steps to Address Global Covid-19 Vaccine Shortage,1,0.154,0.846,0.0,-0.25
504,North Korea unresponsive to behind-the-scenes Biden administration outreach - U.S. official,1,0.0,0.811,0.189,0.2732
505,Biden will deploy FEMA to care for teenagers and children crossing border in record numbers,1,0.0,0.814,0.186,0.4939
506,How should Biden handle Myanmar?,1,0.0,1.0,0.0,0.0
507,Bolivias former president Jeanine Añez was arrested today by Evo Morales government. What should if anything Joe Biden do in response to this?,1,0.124,0.876,0.0,-0.4767
508,Biden bad,1,0.778,0.222,0.0,-0.5423
509,"Biden doesn't have an open-border policy, but I wish he did like conservative news sites say he does.",1,0.0,0.688,0.312,0.7783
510,So apparently Mnuchin got more than a trillion bucks stocked ahead of time for the next stimulus package just for Biden to use—thanks Munchin!,1,0.0,1.0,0.0,0.0
511,White House Chief of Staff Ron Klain says Biden admin supports HR1 but won’t commit to changes to filibuster rule,1,0.0,0.798,0.202,0.5499
512,White House Chief of Staff Ron Klain says Biden admin supports HR1 but won’t commit to supporting changes to filibuster rule,1,0.0,0.682,0.318,0.8126
513,If there is a 2nd Biden stimulus bill (and it’s looking like there will be) what should be in it that there wasn’t in the others?,1,0.0,0.906,0.094,0.3612
514,"Biden commits to 'free, open, secure' Indo-Pacific in rare op-ed with 'Quad' members",1,0.0,0.759,0.241,0.3612
515,Joe Biden Physically Destroys the Welfare Cliff with his Baseball Bat,1,0.265,0.735,0.0,-0.5574
516,Biden Eyes First Major Tax Hike Since 1993 in Next Economic Plan,1,0.0,1.0,0.0,0.0
517,‘Most influential voice’: Warren’s network spreads throughout Biden administration,1,0.0,0.734,0.266,0.4404
518,"Biden would not raise taxes on anyone making less than $400,000: White House",1,0.0,1.0,0.0,0.0
519,"Biden opposes reopening a controversial child migrant shelter in Florida that's been run by a for-profit company, telling the federal agency overwhelmed with caring for migrant minors to find other options",1,0.056,0.807,0.137,0.3818
520,Obama Urges Biden Gaffe Tax to Close Budget Deficit,1,0.252,0.748,0.0,-0.4019
521,Imagine being this braindead to the point where you think North Korea rejecting Biden as president is a sign that Trump is still president.,1,0.12,0.88,0.0,-0.4588
522,"""Maybe I was wrong about Joe Biden – is he actually the progressive president I was waiting for? "" AKA The Guardian gets Biden pilled",1,0.134,0.866,0.0,-0.4767
523,Opinion | The latest GOP attack on Biden has a huge hole in it,1,0.201,0.649,0.149,-0.2023
524,Can Joe Biden design a more humane border policy without encouraging more people to come?,1,0.176,0.824,0.0,-0.4168
525,How would you rate the potential premiership of Bisher Al-Khasawneh (Jordan)?,1,0.0,1.0,0.0,0.0
526,Chad Biden vs Virgin Class Reductionists,1,0.0,1.0,0.0,0.0
527,Biden Has a Border Problem,1,0.474,0.526,0.0,-0.4019
528,Biden says he supports reforming Senate filibuster in ABC News exclusive interview,1,0.0,0.714,0.286,0.4588
529,Sahil Kapur on Twitter: Biden says he supports talking filibuster,1,0.0,0.783,0.217,0.3612
530,"Biden, for the first time, says he wants to overhaul the filibuster",1,0.0,1.0,0.0,0.0
531,Biden tells migrants 'don't come over' in ABC News exclusive interview,1,0.0,0.87,0.13,0.128
532,How will kamala harris do if she ran for president in 2024?,1,0.0,1.0,0.0,0.0
533,Democratic Strategy for the future with 99% success guarantee - How selfish Californians / New Yorkers stands in (y)our way into a prosperous future,1,0.107,0.588,0.304,0.6908
534,"In a shift, Joe Biden endorses a 'talking filibuster' to change Senate rules",1,0.0,0.806,0.194,0.34
535,"Biden talks Cuomo, Putin, migrants, vaccine in ABC News exclusive interview",1,0.0,0.87,0.13,0.128
536,Joe Biden is giving left parties the world over a masterclass in how to use power,1,0.0,0.718,0.282,0.6249
537,"Biden receives high marks on COVID-19, lags on immigration, guns: POLL",1,0.2,0.8,0.0,-0.3612
538,"Democrats Prepare To Push Biden For A $10 Trillion, Decade-Long Green Infrastructure Plan",1,0.0,1.0,0.0,0.0
539,Questions on Neo Liberal Ideology,1,0.0,1.0,0.0,0.0
540,"Left wing criticism of Biden's immigration policy and ""kids in cages""",1,0.225,0.775,0.0,-0.4404
541,Biden-Like House Candidates Beat Those to Their Left,1,0.0,1.0,0.0,0.0
542,"“I may be Irish, but I’m not stupid.” (Joe Biden)",1,0.0,1.0,0.0,0.0
543,Biden cancels another $1.3 billion in student loan debt,1,0.386,0.614,0.0,-0.5267
544,The Biden administration makes a swath of ocean between New York and New Jersey an offshore wind zone.,1,0.0,1.0,0.0,0.0
545,Biden plans to dramatically increase offshore wind energy development,1,0.0,0.614,0.386,0.5267
546,How would you rate the premiership of Maeen Saeed (Yemen)?,1,0.0,1.0,0.0,0.0
547,Biden Changes His Own ‘Paradigm’,1,0.0,1.0,0.0,0.0
548,"Joe Biden snubs the BBC: ""I'm Irish!"" (My second post about God Emperor Biden—to quote a redditor in this sub—today. I’ve already shared this link in a comment below my first post, but this deserves a post of its own)",1,0.052,0.859,0.089,0.126
549,Are y’all really neoliberals?,1,0.0,1.0,0.0,0.0
550,my better Biden cabinet,1,0.0,0.508,0.492,0.4404
551,Biden Names Diverse Nominees for the Federal Bench,1,0.0,1.0,0.0,0.0
552,Biden says up to 90% of adults will be eligible for Covid vaccine by 19 April,1,0.0,1.0,0.0,0.0
553,"Joe Biden is so good at his job, a frazzled Sean Hannity is now vaping on live TV",1,0.0,0.81,0.19,0.5777
554,Biden administration is preparing a new $3 trillion dollars tax hike to fund their infrastructure and climate change plan,1,0.0,1.0,0.0,0.0
555,Biden decides to shelve Warren’s wealth tax,1,0.0,0.652,0.348,0.4939
556,Biden to re-allow H1-B visas,1,0.0,1.0,0.0,0.0
557,Biden to Let Trump’s H1-B Visa Ban Expire in Win for Tech Firms,1,0.196,0.598,0.207,0.0516
558,Will the Biden stimulus lead to inflation? A conversation with Larry H. Summers and Paul Krugman,1,0.0,1.0,0.0,0.0
559,Biden kicks off effort to reshape U.S. economy with infrastructure package,1,0.0,1.0,0.0,0.0
560,US Treasuries waver ahead of Biden stimulus speech,1,0.0,0.787,0.213,0.2263
561,Joe “YIMBY” Biden,1,0.0,1.0,0.0,0.0
562,"Biden administration releases annual human rights report which reaffirms recognition of Jerusalem as Israel's capital and Israeli sovereignty over the Golan Heights, but also reintroduces the goal of a future Palestinian state removed by Trump administration",1,0.0,1.0,0.0,0.0
563,Biden issues first presidential proclamation on Trans Day of Visibility,1,0.0,1.0,0.0,0.0
564,Joe Biden nominates first Muslim as federal judge,1,0.0,1.0,0.0,0.0
565,Canadians hope for 'common sense' on Buy American as Biden talks infrastructure,1,0.0,0.791,0.209,0.4404
566,Ruh roh! Biden pooch drops doggie doo in White House hallway,1,0.0,1.0,0.0,0.0
567,"Biden Is Too Worried About the Deficit, Not Worried Enough About Climate Change",1,0.415,0.585,0.0,-0.7269
568,"SMOKING WEED (aka GRASS) is NOT a good idea. I’ve tried it (back in the day) and it was WORSE than anything that happened to HUNTER BIDEN. I “toked up” with some buddies in Kentucky and woke up 4 days later in Nairobi, Kenya. With no idea what happened. DON’T DO DRUGS. !ping SHITPOSTERS",1,0.154,0.846,0.0,-0.8285
569,Mods bad,1,0.778,0.222,0.0,-0.5423
570,Russian Troop Movements on Ukraine Border Test Biden Administration,1,0.0,1.0,0.0,0.0
571,An in-depth analysis of why America’s Overton Window means Joe Biden would be far-right in Europe,1,0.0,1.0,0.0,0.0
572,"The contradictions of pragmatism: Biden as neoliberal savior, Biden as the protectionist killer of neoliberalism",1,0.337,0.663,0.0,-0.765
573,"""some of you are cool, don't come to Joe's house tomorrow"" - major biden",1,0.0,0.839,0.161,0.3182
574,Biden stimulus bill,1,0.0,1.0,0.0,0.0
575,Strongest Characters in Neo No Liberu,1,0.242,0.44,0.319,0.1779
576,Opinion | We need our schools to stay open this summer. Only Biden can make it happen.,1,0.0,1.0,0.0,0.0
577,I Am Part of the Resistance Inside the Biden Administration,1,0.0,1.0,0.0,0.0
578,Opinion | Biden might just understand public opinion better than his critics,1,0.156,0.638,0.206,0.1779
579,"Biden is looking into his 'legal authority' to cancel student loan debt, White House Chief of Staff Ron Klain told Politico",1,0.185,0.7,0.115,-0.4019
580,"The failings of Neoliberalism from a leftist perspective pertaining to national issues using the insight of great minds like Marx, DB Dubois, Ryan Knight and more. (1/69)",1,0.098,0.701,0.201,0.5267
581,The Case Against Joe Biden,1,0.0,1.0,0.0,0.0
582,Biden Nominates Rahm Emanuel To Head The FDA,1,0.0,1.0,0.0,0.0
583,Biden asks Education secretary to see if he can legally cancel student debt,1,0.283,0.629,0.088,-0.4767
584,Biden administration invokes Civil Rights Act to stall Texas highway widening,1,0.153,0.847,0.0,-0.2023
585,Why has Biden not spoken to Zelensky yet?,1,0.0,1.0,0.0,0.0
586,"Ladies and gentlemen, President Joe Biden and his Cabinet",1,0.0,1.0,0.0,0.0
587,'This is the first international insurrection during the Biden Presidency': Alan Jones,1,0.0,1.0,0.0,0.0
588,Why does this sub hate the idea of Biden forgiving student loans?,1,0.223,0.602,0.175,-0.2023
589,"Ossoff Breaks with Biden, Opposes Call to Move MLB All-Star Game from Georgia",1,0.0,1.0,0.0,0.0
590,Biden to review executive authority to cancel student debt,1,0.381,0.508,0.11,-0.4939
591,POV: You just said Biden shouldn't rejoin the TPP,1,0.0,1.0,0.0,0.0
592,"White House Wants Nuclear in Clean Energy Mandate, Biden Adviser Says",1,0.0,0.652,0.348,0.5859
593,Biden speaks with Ukrainian President Zelenskyy amid Rapidly Escalating Situation,1,0.0,1.0,0.0,0.0
594,Biden: Raising taxes will not slow the economy,1,0.0,1.0,0.0,0.0
595,"Biden calls Ukraine's leader, pledges ""unwavering support"" for Ukraine in the face of Russian ""aggression""",1,0.0,0.838,0.162,0.4019
596,Gaffe-Prone Biden Embarrasses Nation Yet Again By Sneezing During Meeting,1,0.231,0.769,0.0,-0.4019
597,Biden affirms U.S. 'unwavering support' for Ukraine in call: statement,1,0.0,0.769,0.231,0.4019
598,Biden Promised an LGBT Bill. Joe Manchin Is Poised To Kill It.,1,0.258,0.495,0.247,-0.296
599,Joe Biden signing a second wave covid relief bill with the new V.P and first lady in the new presidential loveseat,1,0.0,0.86,0.14,0.4767
600,Biden revokes Trump executive order sanctioning International Criminal Court officials,1,0.274,0.726,0.0,-0.5267
601,"Biden broadband plan will be hated by big ISPs, welcomed by Internet users",1,0.239,0.625,0.136,-0.4215
602,Biden Chief of Staff on Free market,1,0.0,0.645,0.355,0.5106
603,When People Say Nothing Will Fundamentally Change Under Biden...,1,0.0,1.0,0.0,0.0
604,"Holy moly i just realised Biden is the president and democrats have trifecta in the government (duh), so the american jobs act that includes building of public housing and relaxing zoning can actually pass. What a time we are living in",1,0.0,0.922,0.078,0.4939
605,Biden Wants You Out of Your Car and on the Train,1,0.0,1.0,0.0,0.0
606,Thoughts on the resolutions the Liberal Party of Canada has up for their national convention?,1,0.0,0.838,0.162,0.4019
607,Biden is the Democratic Party,1,0.0,0.597,0.403,0.4019
608,"Biden Commerce Secretary Raimondo: Chinese Metal Tariffs Are Imperfect But ""Have worked, insofar as they have leveled the playing field""",1,0.076,0.824,0.101,0.1406
609,Trump leaves Biden with an EU trade time bomb,1,0.286,0.714,0.0,-0.4939
610,Biden Can Help Armenia and Azerbaijan Make Peace. Here’s How.,1,0.0,0.563,0.437,0.7351
611,How Joe Biden tamed the left — at least for now,1,0.0,1.0,0.0,0.0
612,"The US used to fear federal spending, but Biden knows the mood has changed",1,0.139,0.861,0.0,-0.2732
613,Biden Nominates Wife Of Powerful Sen. Joe Manchin To ‘Key’ Post,1,0.0,0.781,0.219,0.4215
614,Me and the boys after casting our votes for the current President Joe Biden. #VotingSquad,1,0.0,1.0,0.0,0.0
615,This sub whenever someone from the Biden administration praises protectionism,1,0.0,0.726,0.274,0.5267
616,Biden faces backlash from US states to his clean energy agenda,1,0.0,0.652,0.348,0.5859
617,"Biden Actively Considering Cancelling Student Loan Debt Of Up To $50,000",1,0.295,0.548,0.158,-0.25
618,"Biden Ditches Warren’s Wealth Tax in Favor of Raising Corporate Tax, Closing Loopholes, Ending Subsidies",1,0.0,0.688,0.312,0.7096
619,Sign this petition to ask Joe Biden to end warrior training in police departments. I've got 432 signatures so far but I need much more for him to take it seriously,1,0.066,0.934,0.0,-0.2617
620,Opinion: How Russia’s military activity near Ukraine is poised to test the Biden administration,1,0.0,0.867,0.133,0.25
621,Arab Americans after Joe Biden said inshallah during the debate. 🧕🏼,1,0.0,1.0,0.0,0.0
622,Narrow Technocratic Reinterpretation FTW,1,0.0,0.446,0.554,0.5766
623,Schumer: Senate will act on marijuana legalization with or without Biden,1,0.0,1.0,0.0,0.0
624,Deportations and Arrests of Immigrants in the U.S. Illegally Fall Sharply Under Biden - WSJ,1,0.182,0.818,0.0,-0.4404
625,"Don't forgive $50,000 in student loan debt. It's bad for Joe Biden, Democrats and America.",1,0.394,0.606,0.0,-0.7791
626,"No, Biden Isn’t Actively Considering Cancelling $50,000 Of Student Loans",1,0.301,0.526,0.173,-0.1779
627,Biden and the waning of the ‘neoliberal’ era - The Washington Post,1,0.0,1.0,0.0,0.0
628,How would you rate the premiership of Haitham bin Tariq (Oman)?,1,0.0,1.0,0.0,0.0
629,"Biden put the whole arm in the rim, Vince Carter",1,0.0,1.0,0.0,0.0
630,Biden and the waning of the ‘neoliberal’ era,1,0.0,1.0,0.0,0.0
631,Neoliberals are growing on me and Populists/Progressives are losing my interest,1,0.17,0.523,0.307,0.2732
632,Biden taps former Senator Bill Nelson to lead NASA,1,0.0,1.0,0.0,0.0
633,Biden moving Vaccine-eligibility goal to April 19th.,1,0.0,1.0,0.0,0.0
634,Fact check: Biden administration officials falsely describe infrastructure jobs estimate,1,0.0,1.0,0.0,0.0
635,Georgia's election law has pros and cons. But Biden needs to keep it honest.,1,0.0,0.745,0.255,0.6652
636,Jeff Bezos: Amazon Supports Tax Hike Under Biden Infrastructure Plan,1,0.0,0.656,0.344,0.4939
637,Should Joe Biden cut all ties with Saudi Arabia?,1,0.208,0.792,0.0,-0.2732
638,Biden Softens Tax Proposal Aimed at Profitable Companies That Pay Little,1,0.105,0.677,0.218,0.3612
639,Biden shows that only moderates can govern from the left - Janan Ganesh,1,0.0,1.0,0.0,0.0
640,America Has Long Favored Cars Over Trains and Buses. Can Biden Change That?,1,0.0,0.811,0.189,0.4215
641,Opinion | Biden Should Finish the Wall,1,0.0,1.0,0.0,0.0
642,The Biden administration says it may restart construction of the border wall to fill 'gaps' left by Trump,1,0.0,1.0,0.0,0.0
643,President Biden says “China and the rest of the world is racing ahead of us in the investments they have in the future. America’s no longer the leader of the world because we’re not investing.”,1,0.061,0.939,0.0,-0.296
644,"Biden to nominate gun control advocate Chipman to lead Bureau of Alcohol, Tobacco, Firearms and Explosives",1,0.138,0.862,0.0,-0.34
645,How the parliamentarian could reshape the Biden agenda,1,0.0,1.0,0.0,0.0
646,'The Senate has discovered water': How the parliamentarian could reshape the Biden agenda,1,0.0,1.0,0.0,0.0
647,Opinion | The GOP can’t be saved. Center-right voters need to become Biden Republicans.,1,0.0,0.811,0.189,0.4215
648,Manchin says there is ‘no circumstance’ where he would vote to get rid of or ‘weaken’ the filibuster in blow to Biden agenda,1,0.0,1.0,0.0,0.0
649,Manchin says there is ‘no circumstance’ where he would vote to get rid of or ‘weaken’ the filibuster in blow to Biden agenda,1,0.0,1.0,0.0,0.0
650,White House under fire over Major Biden promotion to lieutenant colonel,1,0.194,0.806,0.0,-0.34
651,Interesting findings from the Reuters/Ipsos March 30-31 poll.,1,0.0,0.722,0.278,0.4019
652,Biden looks to appoint special envoy to kill Russia-Germany energy pipeline,1,0.269,0.457,0.274,-0.2263
653,"Biden seeks to ease housing shortage with $5 billion 'carrot, no stick' approach",1,0.251,0.599,0.15,-0.1779
654,"Biden tightens some gun controls, says much more needed",1,0.231,0.769,0.0,-0.34
655,Asylum-Seekers Expelled by Biden Administration Say They Feel Deceived,1,0.412,0.588,0.0,-0.5994
656,"Biden calls for ban on assault weapons, high-capacity magazines",1,0.632,0.368,0.0,-0.8834
657,Shift: How the Democratic Party Went From the Party of the New Deal to the Party of Neoliberalism,1,0.0,0.649,0.351,0.7964
658,Four Ways of Looking at the Radicalism of Joe Biden,1,0.0,1.0,0.0,0.0
659,"Biden’s New 2021 Corporate Tax Reforms; Closing the Loopholes, Explained",1,0.0,1.0,0.0,0.0
660,Biden Proposes $715 Billion for Pentagon in First Budget Outline,1,0.0,1.0,0.0,0.0
661,Fellow gun haters: Please stop pushing the Federal Assault Weapons Ban,1,0.742,0.164,0.094,-0.9413
662,"Biden seeks huge funding increases for education, health care and environmental protection in first budget request to Congress - WaPo",1,0.0,0.756,0.244,0.6705
663,Is there a Biden copypasta to send to magats and online lefties?,1,0.0,1.0,0.0,0.0
664,Biden Creating Commission to Study Expanding the Supreme Court - The commission will also examine other potential changes such as term limits for justices. Progressives are pushing President Biden to add seats to balance the court’s conservative majority.,1,0.0,0.858,0.142,0.7003
665,"Biden seeks huge funding increases for education, health care and environmental protection in first budget request to Congress",1,0.0,0.744,0.256,0.6705
666,"Biden pushes for a new, $6.5 billion agency aimed at curing cancer",1,0.306,0.694,0.0,-0.6597
667,Opinion | Biden wants to boost democracy around the world. But what about the despots who are U.S. allies?,1,0.0,0.902,0.098,0.2144
668,"Biden requests $753B defense budget, a slight increase",1,0.0,0.568,0.432,0.4215
669,"Biden budget seeks more for schools, health care and housing",1,0.0,0.738,0.262,0.4939
670,"GOP Senator Whines That Biden Isn't as Stark Raving Mad as Trump, Jen Psaki Knocks Him Back - The Politicus",1,0.261,0.739,0.0,-0.7184
671,‘Outdated War On Drugs Playbook’: Liberals Fume Over Biden Decision On Fentanyl,1,0.379,0.621,0.0,-0.7269
672,Joe Biden and the New Progressive Era,1,0.0,1.0,0.0,0.0
673,Joe Biden is Good at This,1,0.0,0.633,0.367,0.4404
674,"Biden likely to cut about $700 billion from his infrastructure plan in compromise, Goldman says",1,0.13,0.87,0.0,-0.2732
675,Ross Douthat: What Bidenism Owes To Trumpism,1,0.0,1.0,0.0,0.0
676,A bloc of Senate Republicans prepare their own infrastructure plan as Biden tries to ramp up outreach,1,0.0,0.877,0.123,0.2732
677,Biden Finally Got to Say No to the Generals,1,0.216,0.784,0.0,-0.296
678,Former world leaders call on Biden to suspend Covid-19 vaccine patents,1,0.187,0.813,0.0,-0.3182
679,Biden Administration to Impose Tough Sanctions on Russia,1,0.381,0.619,0.0,-0.4019
680,Thoughts On Leaving Afghanistan,1,0.0,1.0,0.0,0.0
681,Inside the surprisingly close Biden-Manchin relationship,1,0.0,0.694,0.306,0.296
682,Biden Administration to Impose Tough Sanctions on Russia,1,0.381,0.619,0.0,-0.4019
683,"Biden administration imposes significant economic sanctions on Russia over cyberspying, efforts to influence presidential election",1,0.086,0.802,0.111,0.1027
684,"Reality check: Biden's Afghanistan policy is populist, shameful, and a costly military blunder",1,0.315,0.685,0.0,-0.5574
685,"Biden Nears 100-Day Mark With Strong Approval, Positive Rating for Vaccine Rollout",1,0.0,0.474,0.526,0.875
686,"Reversing Trump, Biden Restores Aid to Palestinians",1,0.0,0.732,0.268,0.296
687,Why has biden been pursuing bad policy?,1,0.368,0.632,0.0,-0.5423
688,Biden is asking Congress for $670M to end the HIV/AIDS pandemic (The Hill),1,0.0,1.0,0.0,0.0
689,"Biden resists raising refugee cap over political optics, sources say",1,0.0,1.0,0.0,0.0
690,Vox: The Biden &amp; Klobuchar plans to tackle exclusionary zoning,1,0.0,1.0,0.0,0.0
691,Biden administration in no rush to rejoin Trans-Pacific Partnership as it reviews inherited trade policies and focuses on domestic agenda,1,0.104,0.896,0.0,-0.296
692,Throwback to the Biden passionately thanking african americans for helping him win,1,0.0,0.489,0.511,0.8555
693,"[NYT] Biden to keep Trump era refugee caps, walking back earlier pledge",1,0.0,1.0,0.0,0.0
694,Biden will keep Trump’s historically low cap on refugee admissions,1,0.189,0.811,0.0,-0.2732
695,Biden to sign declaration that speeds refugee admissions without raising refugee cap,1,0.0,1.0,0.0,0.0
696,"Biden administration to keep refugee cap at Trump’s level, far less than what it proposed to Congress",1,0.0,1.0,0.0,0.0
697,This is awful. Biden is limiting refugees admissions hard over fears about the border crisis.,1,0.507,0.493,0.0,-0.8834
698,What would you do if Biden's climate policy was too weak?,1,0.225,0.775,0.0,-0.4404
699,What would you do if Biden's climate policy was too weak?,1,0.225,0.775,0.0,-0.4404
700,What would you do if Biden's climate policy was too weak?,1,0.225,0.775,0.0,-0.4404
701,What would you do if Biden's climate policy was too weak?,1,0.225,0.775,0.0,-0.4404
702,What would you do if Biden's climate policy was too weak?,1,0.225,0.775,0.0,-0.4404
703,Senate Democrats urge Biden to deny funds for Brazil Amazon,1,0.198,0.661,0.14,-0.1779
704,Biden to keep refugee cap at historically low figure set by Trump,1,0.16,0.84,0.0,-0.2732
705,Biden hits 59 percent approval rating in Pew poll,1,0.0,0.721,0.279,0.4767
706,"As Biden Pulls Out of Afghanistan, How Much Do Americans Care?",1,0.0,0.758,0.242,0.4939
707,"(AP) — After blowback from allies, White House says President Biden will move to lift Trump-era refugee caps next month.",1,0.0,1.0,0.0,0.0
708,The rare anti-Biden meme,1,0.0,1.0,0.0,0.0
709,"Mr Biden, I don’t feel so good",1,0.0,0.572,0.428,0.5777
710,"After backlash, Biden will increase the limit on refugee admissions.",1,0.0,0.796,0.204,0.3182
711,White House now says Biden will move to increase refugee cap by May 15,1,0.0,0.85,0.15,0.3182
712,The Economist: Joe Biden is wrong to withdraw American troops from Afghanistan,1,0.22,0.78,0.0,-0.4767
713,Joe Biden offers unconvincing reasons for ending America’s longest war -- The Biden administration has missed an opportunity to show its mettle,1,0.219,0.681,0.1,-0.5106
714,"Biden administration, like Trump, tries to dismiss lawsuit against ICE over fake university scheme",1,0.27,0.595,0.135,-0.3612
715,Trump-era NSA appointee resigns after Biden admin placed him on monthslong administrative leave,1,0.241,0.759,0.0,-0.3612
716,"I'm not saying I believe in 10th dimensional chess, but if I did believe in 10th dimensional chess, getting the anti-immigrant and anti-Biden press to rave about the refugee program for half a day before saying the cap is only temporary would certainly be 10th dimensional chess.",1,0.0,0.933,0.067,0.4767
717,Biden uses meeting with Japanese Prime Minister to emphasize new focus on China,1,0.0,1.0,0.0,0.0
718,"Biden to lift Trump-era refugee cap in May amid pushback from Democrats, advocates",1,0.0,1.0,0.0,0.0
719,Joe Biden has been president for 87 days and he hasn't un-recognized Morocco's illegal annexation of Western Sahara,1,0.0,0.853,0.147,0.4449
720,"Just drawing a parallel line between the toxic Sanders supporters and the toxic part of the Romanian leftist community, with which I interacted for a while",1,0.0,0.884,0.116,0.4404
721,Biden says Saturday he will raise U.S. cap on refugee admissions,1,0.0,1.0,0.0,0.0
722,Biden Can Redeem His Mistake in Vietnam,1,0.286,0.714,0.0,-0.34
723,"Debating Exit From Afghanistan, Biden Rejected Generals’ Views",1,0.32,0.68,0.0,-0.5106
724,"Even as supply lines strain, Biden is in no rush to scrap Trump’s steel tariffs",1,0.207,0.793,0.0,-0.34
725,Joe Biden offers unconvincing reasons for ending America’s longest war,1,0.302,0.698,0.0,-0.5994
726,Biden moves to leverage corporate America's falling out with GOP,1,0.151,0.849,0.0,-0.1531
727,"The US's vaccination strategy has been very successful, but it has come at the cost of hurting the rest of the world through blocking exports",1,0.221,0.698,0.081,-0.6601
728,Leftists Didn't Get Biden Wrong. They LIED About Him.,1,0.259,0.543,0.198,-0.1972
729,"Aerial spraying of coca fields in Colombia: an inefficient, costly, and dangerous anti-drug strategy",1,0.273,0.727,0.0,-0.5423
730,"As Biden approaches 100th day in office, Republicans admit difficulties in attacking his agenda",1,0.289,0.611,0.1,-0.5267
731,Biden Rejects Russia Dove for Key Post,1,0.348,0.652,0.0,-0.4939
732,Biden Administration taking regressive approach on TPS,1,0.0,1.0,0.0,0.0
733,Points of Interest from my Friend who served in Afghanistan Regarding US Withdrawal,1,0.0,0.578,0.422,0.743
734,Mine workers union endorses Biden energy policies in exchange for job training,1,0.0,0.69,0.31,0.5423
735,Opinion | Biden wasn’t really ready ‘on Day 1.’ His stumble on refugee numbers shows why.,1,0.0,0.834,0.166,0.4201
736,How Joe Biden Can Renew America’s National Dialogue,1,0.0,1.0,0.0,0.0
737,IMPORTANT - Neoliberal Donald Trump and Joe Biden Ship Poll,1,0.0,0.76,0.24,0.368
