,title,subreddit,neg,neu,pos,compound
1570,New homebuyers would get tons of cash under plans from Biden and his party,0,0.0,0.828,0.172,0.4019
1571,"Fauci thinks herd immunity 'doesn't really apply' to COVID, Biden chief of staff says",0,0.0,1.0,0.0,0.0
1572,Biden 6 weeks of summer,0,0.0,1.0,0.0,0.0
1573,Joe Biden = Jimmy Carter,0,0.0,1.0,0.0,0.0
1574,More Than 300 Manufacturers Just Asked Biden To Repeal Trump's Steel Tariffs as Prices Skyrocket,0,0.0,1.0,0.0,0.0
1575,Three Reasons Why the Biden Tax Increase Makes No Sense,0,0.176,0.64,0.184,0.0258
1576,Biden Adminsitration Being Sued for Giving Government Loan Forgiveness to Only Non-White Farmers,0,0.0,0.71,0.29,0.5423
1577,"Reporter: ""Does [The President] think this was a lab leak?"" Psaki: ""The president has said and I have said from here many times that there needs to be a credible, independent investigation, through the World Health Organization and one that relies on data; relies on participation from China"" 5/7/21",0,0.0,1.0,0.0,0.0
1578,Biden Continues Trump’s Misguided Trade Policies,0,0.0,1.0,0.0,0.0
1579,"Biden, when he reached office; planned to poison the field of coca plants and was told no. Now after a few weeks there's a civil war starting in Columbia. I'm starting to think he took a page from Regan and used our intelligence networks to start a coop in efforts for the drug war.",0,0.218,0.71,0.073,-0.875
1580,"How can so many self proclaimed “Libertarians” on this sub not realise they are just leftie statist boot lickers, Biden/Bernie f**k boys, and have a constant hard on for ACAB.",0,0.048,0.952,0.0,-0.1027
1581,Biden defends unemployment extension while Republicans blame it for poor jobs numbers,0,0.483,0.517,0.0,-0.8126
1582,"Biden Wants To Resurrect Obama-Era Occupational Licensing Plan for Tax Preparers (Like all licensing schemes, this one will raise prices for consumers, hurt entrepreneurs, and protect the interests of the big guys in the market.)",0,0.085,0.8,0.115,0.0516
1583,"If Biden Truly Wanted To Create Jobs, He Wouldn't Support the PRO Act (Destroying the ability of freelancers to make a living is union protectionism, not economic opportunity.)",0,0.069,0.668,0.264,0.6643
1584,"I Calculated if President Biden will Increase Your Taxes if You Make Under $100,000 - Take a Look!",0,0.0,0.844,0.156,0.3802
1585,Biden says federal unemployment supplement didn’t cause poor jobs report,0,0.429,0.571,0.0,-0.7184
1586,In Michigan: Votes were changed from Jo Jorgensen to Donald Trump to Joe Biden.,0,0.0,1.0,0.0,0.0
1587,Biden Can't Explain Why He's Still Wearing a Mask,0,0.0,1.0,0.0,0.0
1588,You don’t have to be left wing or progressive to be libertarian!,0,0.0,0.834,0.166,0.2942
1589,Biden Proposes $2 Trillion Bill To Study What's Causing Inflation Rates To Rise,0,0.0,1.0,0.0,0.0
1590,Biden Administration Spending: Inflation Threat &amp; Milton Friedman's Revenge,0,0.493,0.507,0.0,-0.7783
1591,Biden Urges Israel To Only Use $3.8bn In US Military Aid For ‘Nice Stuff’,0,0.0,1.0,0.0,0.0
1592,Biden Proposes $2 Trillion Bill To Study What's Causing Inflation Rates To Rise. Lolz.,0,0.0,0.778,0.222,0.5719
1593,"It's Too Late with Alan Mosley 157: Dollars for Collars, talking about the Biden admin proposal to employ an army of informants to get around those pesky constitutional limits on spying.",0,0.068,0.932,0.0,-0.296
1594,Who thinks President Biden will cancel student debt? Also state an argument for or against.,0,0.368,0.632,0.0,-0.7184
1595,"Biden: consistent in his stance that only the state has the right of ""defence"".",0,0.0,1.0,0.0,0.0
1596,Everything You need to know about Israel and Gaza fight and how US President Joe Biden Responded,0,0.14,0.86,0.0,-0.3818
1597,A Question.,0,0.0,1.0,0.0,0.0
1598,REPORT: Biden Has Scolded His Aides In Profanity-Laced Outbursts,0,0.0,1.0,0.0,0.0
1599,Inflation is Skyrocketing. Biden = Jimmy Carter v3.0,0,0.0,1.0,0.0,0.0
1600,"""The rule is now simple: get vaccinated or wear a mask until you do. The choice is yours."" - President Biden",0,0.0,1.0,0.0,0.0
1601,"""Biden and Trump are totally the same on borders guys.""",0,0.0,1.0,0.0,0.0
1602,ISPs claim broadband prices aren’t too high—Biden admin isn’t buying it,0,0.0,1.0,0.0,0.0
1603,Biden refuses to admit whether $4M ransom was paid to pipeline hackers,0,0.0,0.859,0.141,0.2023
1604,"Biden ""unequivocally"" supports Israel as it destroys private property, kills civilians and children and steals other people's homes. I wonder when Biden/Dem fans are going to realise they're almost as bad as the Reps.",0,0.309,0.635,0.057,-0.9026
1605,The Republicans will attempt to overthrow democracy again in 2024 and will succeed.,0,0.0,0.789,0.211,0.4939
1606,Nashville gas station trolls Hunter Biden: 'Hope gas prices don't get too high',0,0.0,0.805,0.195,0.4404
1607,K.T. McFarland: Special Counsel Must Be Appointed on Hunter Biden,0,0.0,0.769,0.231,0.4019
1608,The Biden administration will begin making monthly child tax credit payments in July.,0,0.0,0.822,0.178,0.3818
1609,Biden Wants a Global Minimum Tax to Offset His Proposed Huge Corporate Tax Increase,0,0.0,0.705,0.295,0.5574
1610,"Boeing Sold $735 Million Worth of Precision Targeting Systems for Bombs to Israel | Biden approved the deal and Congress was notified May 5th, they have til the 20th to object | Israel used the bomb guidance tech against targets in Gaza a week after Biden disclosed the deal to congress",0,0.0,0.838,0.162,0.8271
1611,Biden approves $735M weapons sale to Israel,0,0.274,0.472,0.255,-0.0516
1612,"David Frum: Don’t Politicize the Lab-Leak Theory | While the Biden administration should defend U.S. scientists against partisan defamation, it has no reason to protect China against the truth, whatever that may be",0,0.061,0.803,0.136,0.4019
1613,Biden jokes about RUNNING OVER reporter after getting question about Israel (VIDEO),0,0.0,0.846,0.154,0.25
1614,Had to make this form on Biden for my government class.,0,0.0,1.0,0.0,0.0
1615,Did Chris Webby go from Liberal rapper to Libertarian?,0,0.0,0.808,0.192,0.2263
1616,Federal judge says Biden restaurant fund discriminated against white male,0,0.0,1.0,0.0,0.0
1617,"Biden Administration Has Allowed 61,000 Illegal Immigrants Into US",0,0.31,0.69,0.0,-0.5574
1618,Biden gas shortage causes panic amongst citizens,0,0.515,0.485,0.0,-0.6486
1619,Biden quotes Chinese Communist dictator who killed 80M people in address to Coast Guard cadets,0,0.243,0.757,0.0,-0.6705
1620,Senate panel advances Biden pick as WH science adviser,0,0.0,1.0,0.0,0.0
1621,Rep. Keller: Biden policies dragging down economic recovery,0,0.0,1.0,0.0,0.0
1622,"Biden, Media Show Contempt for Israel's Right of Self-Defense",0,0.322,0.678,0.0,-0.5859
1623,"Former FBI director reportedly gave $100K to Biden grandchildren's trust, emailed Hunter that he'd like to work 'with you and dad'",0,0.0,0.766,0.234,0.7003
1624,Biden administration proposes global minimum tax of at least 15%,0,0.0,1.0,0.0,0.0
1625,Joe Biden Claims He Is Not a Socialist After $6 Trillion Plan to Redistribute Wealth,0,0.0,0.802,0.198,0.4939
1626,Biden thinks computers are tricky.,0,0.286,0.714,0.0,-0.1531
1627,"Biden Wants To Spy on American Bank Accounts (Plus: Trump administration spied on CNN reporter, the right's wrong turn on economic liberty, and more...)",0,0.109,0.772,0.119,0.0772
1628,Biden claims he will prohibit DoJ from seizing email or phone records from reporters,0,0.0,1.0,0.0,0.0
1629,Biden Fails to Condemn Antisemitic Attacks by Pro-Palestinian Activists Nationwide,0,0.542,0.458,0.0,-0.8074
1630,Biden-Friendly Economist: Bigger Benefit Checks Mean Fewer Workers,0,0.0,0.7,0.3,0.4588
1631,Biden Drops Student Loan Forgiveness From Latest Budget,0,0.0,0.769,0.231,0.2732
1632,"Will Biden's Stimulus fail | President Joe Biden, Stimulus, America, eco...",0,0.28,0.72,0.0,-0.5423
1633,"‘Breaking the News’ Reveals: Secret Service Records Show Hunter Biden Took at Least 23 flights Through Joint Base Andrews, Home of Air Force One and Two",0,0.0,1.0,0.0,0.0
1634,Report: Biden officials made requests to Israel that mirrored demands from Hamas terrorists,0,0.255,0.745,0.0,-0.6249
1635,"Biden, second Catholic president, to skip Notre Dame commencement after backlash to his abortion policies",0,0.0,1.0,0.0,0.0
1636,Major union criticizes Joe Biden over prison closures,0,0.487,0.513,0.0,-0.6908
1637,"""Do-It-Yourself"" Impeachment form for Biden. The Rules of Congress allow citizens to initiate impeachment (info and sources on the website).",0,0.0,0.909,0.091,0.2263
1638,Biden Policies Turn Border Agents Into 'U.S. Welcome Patrol',0,0.0,0.727,0.273,0.4588
1639,I Just Called The FahKing U.S. Capitol Building!!,0,0.0,1.0,0.0,0.0
1640,Keep your big government hands off my single family zoning laws.,0,0.0,1.0,0.0,0.0
1641,George Floyd's family meets with Biden and Harris at White House,0,0.0,1.0,0.0,0.0
1642,Opportunities for Better Federal Housing Policy: How the Biden Administration and Congress Can Improve Housing Affordability,0,0.0,0.607,0.393,0.8126
1643,Biden asks intelligence community to redouble efforts to determine definitive origin of the coronavirus | Biden also pressed China to cooperate amid questions of whether the virus originated in a lab in Wuhan,0,0.0,0.906,0.094,0.4767
1644,"Vote in NM 1st Congressional Seat, Special Election, two third party candidates running",0,0.0,0.671,0.329,0.6597
1645,Biden Labor Department Undermines Gig Economy,0,0.324,0.676,0.0,-0.34
1646,Biden ATF nominee supports ban on AR-15,0,0.324,0.45,0.225,-0.2732
1647,'Enough': Biden urges Congress to pass gun control bills after lowering flag for latest mass shooting,0,0.239,0.761,0.0,-0.5267
1648,President Biden will propose a $6 trillion budget that would take the U.S. to its highest sustained levels of federal spending since World War ll,0,0.145,0.855,0.0,-0.5994
1649,Emails reveal Biden DID meet with Hunter's business partners,0,0.0,1.0,0.0,0.0
1650,Biden orders more intel investigation of COVID-19 origin,0,0.0,1.0,0.0,0.0
1651,Biden Budget Said to Assume Capital-Gains Tax Rate Increase Started in Late April,0,0.0,0.839,0.161,0.3182
1652,Biden Proposing $6 TRILLION Budget That Could Bankrupt America,0,0.31,0.69,0.0,-0.5574
1653,Biden Could Provide Business and Household Relief by Eliminating Trump Tariffs,0,0.0,0.763,0.237,0.4767
1654,"The Biden Administration Has Reduced Deportations More than the Trump Administration, but Not by Much",0,0.0,1.0,0.0,0.0
1655,"Yellen says Biden budget to push U.S. debt higher, not inflation",0,0.2,0.8,0.0,-0.3612
1656,Biden trade czar 'optimistic' U.S.-EU aircraft subsidy spat to end soon,0,0.0,1.0,0.0,0.0
1657,"President Biden says Covid origin report will not be released in promised 90 day time frame if there's something he's ""unaware of"" | Pragmatic realism or duplicitous hedging?",0,0.061,0.853,0.085,0.1779
1658,Biden Expected to Propose $6 Trillion Budget,0,0.0,1.0,0.0,0.0
1659,"""For what it's worth, Ohio's (Vax-A-Million &amp; College Lottery) campaigns are both being paid for using federal dollars allocated to states to help fight the pandemic, which was signed off on by the Biden administration."" So it's ok...",0,0.062,0.829,0.109,0.25
1660,Thank you Biden!,0,0.0,0.417,0.583,0.4199
1661,"Get Ready for $5 Gasoline if You Live in California—or if You Don’t | Golden State laws drive up prices at the pump, and the Biden administration aims to take them national",0,0.0,0.923,0.077,0.3612
1662,"Economists warn big wave of ‘Biden inflation’ coming, say high govt. spending devalues U.S. dollar",0,0.091,0.909,0.0,-0.1027
1663,"Denmark helped NSA spy on Merkel &amp; other European leaders, new reports reveal, as Snowden says Biden was ‘deeply involved’",0,0.0,1.0,0.0,0.0
1664,"Congresswoman Blasts Biden Decision To Block Marijuana Sales In D.C. — “He’s a strong supporter of statehood and homerule, so this was the time for him to—especially since we got rid of the abortion rider, which is even more controversial—this was the time to get rid of the marijuana rider as well.”",0,0.052,0.85,0.098,0.3612
1665,"On Pot Legalization, Biden Offers Only Inaction",0,0.25,0.75,0.0,-0.25
1666,Opinions on the election and it possibly being rigged.,0,0.238,0.762,0.0,-0.3612
1667,Biden opens the back door to universal basic income,0,0.0,1.0,0.0,0.0
1668,"What Makes Biden and Yellen's ""Global Minimum Tax"" Push So Hypocritical",0,0.248,0.752,0.0,-0.5095
1669,"What Makes Biden and Yellen's ""Global Minimum Tax"" Push So Hypocritical",0,0.248,0.752,0.0,-0.5095
1670,The New Domestic War on Terror Has Already Begun -- Even Without the New Laws Biden Wants,0,0.327,0.673,0.0,-0.8074
1671,Lumber Is Crazy Expensive Right Now. Biden Is About To Make It Worse.,0,0.333,0.667,0.0,-0.6705
1672,How can you say you support freedom when you don't support the men and women DEFENDING your freedom?,0,0.0,0.504,0.496,0.93
1673,Biden Targets Crypto Tax Evaders in Global Data-Sharing Pitch,0,0.0,1.0,0.0,0.0
1674,Here Are 3 Glaring Consequences of the $6 Trillion Budget Biden Just Proposed | Brad Polumbo,0,0.0,1.0,0.0,0.0
1675,President Biden to sign executive order to ban investment in 59 Chinese defense and tech firms,0,0.188,0.733,0.079,-0.4767
1676,Joe Biden's Fragile Global Minimum Tax Cartel: The Biden administration is expending a lot of time and energy to make the country more uncompetitive than ever...,0,0.0,0.92,0.08,0.2732
1677,Biden Staffer: Stop Being Jewish In Public,0,0.268,0.732,0.0,-0.296
1678,Biden Borrow and Spend Plan Builds on Trump Legacy and Makes Things Even Worse,0,0.193,0.807,0.0,-0.4767
1679,Biden Borrow and Spend Plan Builds on Trump Legacy and Makes Things Even Worse,0,0.193,0.807,0.0,-0.4767
1680,Trump eyes Congress run to become Speaker and impeach Biden,0,0.0,1.0,0.0,0.0
1681,The Trump and Biden Administrations Waged Secret Legal Battle to Obtain Emails of 4 Times Reporters,0,0.152,0.76,0.088,-0.2732
1682,Look at Ron Paul again shilling for Kremlin regime and pretending that it is Ukraine aggressing against innocent Russia.,0,0.075,0.748,0.178,0.296
1683,Joe Biden Surrenders On Federal Unemployment Benefits,0,0.276,0.476,0.248,-0.0772
1684,Joe Biden Surrenders On Federal Unemployment Benefits,0,0.276,0.476,0.248,-0.0772
1685,4th Amendment doesn't seem to apply to the Biden administration anymore.,0,0.0,1.0,0.0,0.0
1686,Biden Admin’s Proposed Gun Rule Would Turn Millions Into Felons,0,0.211,0.789,0.0,-0.34
1687,Thoughts on Biden failing to mention D Day?,0,0.355,0.645,0.0,-0.5106
1688,Why a Judge Has Georgia Vote Fraud on His Mind: ‘Pristine’ Biden Ballots That Looked Xeroxed,0,0.213,0.787,0.0,-0.5859
1689,"Hunter Biden used the n-word multiple times in casual conversation, text messages show",0,0.0,0.87,0.13,0.2023
1690,President Biden Declares July 4th Independence from the Covid-19 And Free Beer For Everyone 21 years,0,0.0,0.82,0.18,0.5106
1691,Biden quietly moves to start closing Guantánamo ahead of 20th anniversary of 9/11,0,0.0,1.0,0.0,0.0
1692,Our tax dollars hard at work: Biden pushes another 500M doses out of the US,0,0.091,0.909,0.0,-0.1027
1693,Biden Revokes and Replaces Trump Executive Orders That Banned TikTok,0,0.25,0.75,0.0,-0.4588
1694,Watch President Biden and the First Lady Deliver Remarks to US Air Force...,0,0.0,1.0,0.0,0.0
1695,Lumber Is Crazy Expensive Right Now. Biden Is About To Make It Worse (The Commerce Department is planning to hike tariffs on Canadian lumber from about 9 percent to more than 18 percent.),0,0.155,0.845,0.0,-0.6705
1696,Hank Hill is a Libertarian,0,0.0,0.612,0.388,0.2263
1697,"Biden to lay out vacs donations, urge world leaders to join",0,0.0,0.82,0.18,0.296
1698,Biden Might Be Keeping Trump's Cuba Policy to Get More Votes in Miami,0,0.0,1.0,0.0,0.0
1699,The Biden Administration Flirts with Section 232. It Will Backfire.,0,0.0,0.841,0.159,0.1779
1700,"Student loan forgiveness: Biden administration move for disabled borrowers was ‘the bare minimum,’ advocacy group says",0,0.0,0.877,0.123,0.2732
1701,Joe Biden is the best president ever! what do you guys think?,0,0.0,0.71,0.29,0.6696
1702,"Biden to urge G-7 leaders to call out, compete with China",0,0.0,1.0,0.0,0.0
1703,Biden nominee to oversee federal lands linked to ecoterrorism,0,0.0,1.0,0.0,0.0
1704,‘They’re trying to kill Assange because he spoke the truth’: Roger Waters calls on Biden to end ‘disgusting’ sham prosecution,0,0.305,0.695,0.0,-0.836
1705,"A “Slippery, Bootlicking A.G.”? The Media Goes Silent As Garland Adopts Previously Denounced Positions Of Barr | Positions that were once denounced by media and legal experts as raw partisanship have now been adopted by the Biden Administration with little acknowledgement from those same figures",0,0.0,0.928,0.072,0.296
1706,"With Biden in UK, 24 MPs Call on Him to Let Assange Go | A group of 24 members of the UK Parliament have written to President Joe Biden, who is at the G7 Summit in Cornwall, asking him to drop the U.S. prosecution of WikiLeaks publisher Julian Assange",0,0.105,0.895,0.0,-0.6486
1707,Biden draws “firm line” against Justice Department using its “broad powers to hunt down reporters and their records”,0,0.0,0.833,0.167,0.5267
1708,Federal Judge Halts a Racist Biden Administration Program That Discriminated Against White Farmers,0,0.267,0.733,0.0,-0.6124
1709,What ever happened to this solid piece of evidence of voter fraud? The conservative tale of the Biden van that helped steal the election.,0,0.235,0.706,0.059,-0.7391
1710,"Biden, unlike predecessors, has maintained Putin skepticism",0,0.25,0.75,0.0,-0.25
1711,"After G-7, Biden says he's reestablishing US credibility",0,0.0,1.0,0.0,0.0
1712,Biden administration calls for death penalty to be reinstated against Boston bomber despite promising to end executions,0,0.395,0.605,0.0,-0.8465
1713,Did Biden reverse Trump's 4 executive orders on prescription drugs?,0,0.0,1.0,0.0,0.0
1714,Public pins blame for rising inflation on Biden: Poll,0,0.231,0.769,0.0,-0.34
1715,Biden Campaigned on Ending the Death Penalty. His Justice Department Wants To Execute the Boston Marathon Bomber Anyway.,0,0.273,0.593,0.134,-0.5423
1716,Biden administration issues 'gun confiscation order' guidance to states on how to create red flag laws,0,0.13,0.757,0.114,-0.0772
1717,Biden Wants to Give IRS More Money and Power... That sounds like a horrible idea. But the Cato Daily podcast is a good brief libertarian daily podcast for those who are interested. Check it out.,0,0.054,0.671,0.275,0.85
1718,Voting rights debate in the Biden administration. Poll shows that majority of US citizen support HR1 Voting Rights. Major support amongst independents and democrats. 34% of republican support.,0,0.0,0.755,0.245,0.7964
1719,Team Biden Asks Americans to Report Radicalized Friends and Family,0,0.0,0.744,0.256,0.4767
1720,I believe Libertarians failed.,0,0.611,0.185,0.204,-0.4939
1721,Biden Admin Wants Americans To Report ‘Radicalized’ Friends And Family,0,0.0,0.744,0.256,0.4767
1722,This should concern all of us,0,0.0,1.0,0.0,0.0
1723,Guantánamo Detainees Say Conditions Are Worse Since Biden Became President,0,0.256,0.744,0.0,-0.4767
1724,Biden just repeated the false claim that protestors killed a police officer in Jan 6th.,0,0.257,0.743,0.0,-0.6705
1725,"Direct Biden quote from today: ""How would it be if the United States were viewed by the rest of the world as interfering with the elections directly of other countries and everybody knew it?""",0,0.0,0.922,0.078,0.4215
1726,"Joe Biden: ""How would it be if the United States were viewed by the rest of the world as interfering with the elections directly of other countries and everybody knew it? What would it be like if we engaged in activities that he engaged in? It diminishes the standing of a country.""",0,0.0,0.81,0.19,0.8767
1727,"Letter: Hunter Biden repeatedly used the ""N"" word in texts",0,0.0,1.0,0.0,0.0
1728,"Hunter Biden repeatedly called his white lawyer the N-word, texts show",0,0.0,1.0,0.0,0.0
1729,Have We Learned Nothing? Biden Backs Mass Murder in the Middle East,0,0.297,0.631,0.072,-0.6759
1730,Biden signs bill making Juneteenth a federal holiday,0,0.0,0.69,0.31,0.4019
1731,Joe biden wake up,0,0.0,1.0,0.0,0.0
1732,"No cookies for you. Dark ages homosexual hating Men's club wants to deny the President his cookie, juice and chanting because of his support for Abortion. MORONIC GAMES. When will this lunacy end.",0,0.287,0.651,0.063,-0.8636
1733,A family affair: Children and other relatives of Biden aides get administration jobs,0,0.0,1.0,0.0,0.0
1734,Biden freezes military aid to Ukraine after Putin summit as leaders plea for help,0,0.07,0.759,0.171,0.3818
1735,"17 states* have reached 70% of adults vaccinated, every single one voted for Biden.",0,0.0,0.903,0.097,0.1027
1736,Joe Biden and the E.U. Move To Lift Trump's Food Tariffs,0,0.0,1.0,0.0,0.0
1737,There is no reason to expect Biden administration anti-terrorism and anti-extremism efforts to be less of a farce and menace than similar post-9/11 campaigns,0,0.281,0.719,0.0,-0.7796
1738,Fauci Is Innocent! Biden Isn’t Creepy - Breaking News!,0,0.0,0.701,0.299,0.4559
1739,U.S. lawmaker wants Biden to take 'unilateral action' on reopening border with Canada,0,0.0,1.0,0.0,0.0
1740,Time for Biden to take responsibilty,0,0.0,1.0,0.0,0.0
1741,"Hunter Biden selling his art at prices ranging up to half a million dollars to anonymous buyers: ""...selling art at obviously inflated prices and keeping the public in the dark about who's funneling money to him has a shameful and grifty feel to it."" -Obama ethics chief",0,0.091,0.909,0.0,-0.5106
1742,Biden doubles funding for police hiring program,0,0.0,1.0,0.0,0.0
1743,Biden Wants To Seize Control of Local Land-Use Regulations,0,0.0,1.0,0.0,0.0
1744,The Biden Administration's Model 'Red Flag' Law Belies the Justice Department's Supposed Commitment to Due Process,0,0.0,0.7,0.3,0.7184
1745,"As gun violence soars, Biden to target rogue dealers, illegal firearms in new crime strategy",0,0.553,0.447,0.0,-0.9274
1746,"Biden Administration to Fire Fannie, Freddie Regulator, Says White House Official | Supreme Court ruling on Wednesday made it easier for the president to install his preferred overseer",0,0.073,0.732,0.195,0.6124
1747,Why is Joe Biden so keen on fighting “gun violence” aka regular law abiding citizens with threats of more gun violence?,0,0.396,0.502,0.102,-0.8553
1748,Lol...did Biden just threaten American gun owners with nukes and F15s? (Link below),0,0.312,0.688,0.0,-0.6124
1749,Biden Mocks Americans Who Own Guns To Defend Against Tyranny: You'd Need Jets and Nuclear Weapons To Take Us On,0,0.247,0.753,0.0,-0.7096
1750,Is no one going to mention how confusing and out of it Biden was?,0,0.255,0.745,0.0,-0.4767
1751,joe biden increasing funding for white supremacists shows that voting for democrats is a mistake vote green or libertarian instead,0,0.197,0.717,0.085,-0.3612
1752,How I envision the libertarian party actually being successful,0,0.0,0.373,0.627,0.8126
1753,Biden 'Confesses' - There Was No Insurrection!,0,0.333,0.667,0.0,-0.3595
1754,A ‘Saigon moment’: Biden feels political heat as chaos looms in Afghanistan,0,0.371,0.629,0.0,-0.6486
1755,Biden: Insurrectionists 'need nukes' to take on US government | Biden unintentionally shows why support for the 2nd amendment is necessary,0,0.0,0.876,0.124,0.4019
1756,'We have a deal': Biden announces infrastructure agreement,0,0.0,0.652,0.348,0.4939
1757,"Biden announces ""Bipartisan deal on infrastructure"" and Pelosi immediately declares that she won't bring it to vote in the House.",0,0.0,1.0,0.0,0.0
1758,How is Biden's Presidency so far?,0,0.0,1.0,0.0,0.0
1759,"With support of Biden, federal court backs Trump’s police-state assault on peaceful protests in Lafayette Square",0,0.29,0.462,0.248,0.0
1760,"A Scheme to Blow Up the Housing Market Backfired Spectacularly at the Supreme Court | Instead of winning billions for shareholders, the plaintiffs handed Joe Biden tighter control over the mortgage industry.",0,0.0,0.8,0.2,0.7906
1761,Biden under fire after suggesting Latinx people aren’t being vaccinated because of deportation fears,0,0.302,0.698,0.0,-0.6369
1762,Presidential Biden makes the case for privately owned Nukes,0,0.0,1.0,0.0,0.0
1763,Crazy Biden Admin Issues Order Mandating Race Training at Every Level of the Federal Government,0,0.146,0.854,0.0,-0.34
1764,Report: Emails Show Biden Campaign Demanding Facebook Censor Posts on Election Integrity,0,0.297,0.545,0.158,-0.3182
1765,Ron paul got me intrested in libertarianism. Gary Johnson and specifically bill weld turn me off. Vermont supreme got me to become a dues paying member. D. Trump and J. Biden convinced me to vote for Jo Jorgensen. Dave Smith has my support if he runs for president.,0,0.0,0.805,0.195,0.8555
1766,"Joe Biden, ""The 2nd Amendment Always Limited the Weapons You Could Own, You Couldnt Own a Cannon"" - Fact Check: FALSE",0,0.22,0.78,0.0,-0.5859
1767,The US government has agreed to fight the American people.,0,0.205,0.63,0.165,-0.128
1768,Immigrant Congressman Shreds Biden For Using ‘Latinx’: ‘Keep Your Wokeness Out Of Our Language’,0,0.0,1.0,0.0,0.0
1769,Emails Show Biden Campaign Pressured Facebook To Censor Trump Before The Election,0,0.329,0.671,0.0,-0.5994
1770,GOP Reps. call for Joe Biden to take a cognitive test,0,0.0,1.0,0.0,0.0
1771,AOC ADMITS She Won't Fight Biden &amp; Corporate Dems Publicly!,0,0.0,0.597,0.403,0.6607
1772,Republicans are watching their states back weed — and they’re not sold. Conservatives and Biden need to hop on board and legalize it.,0,0.0,1.0,0.0,0.0
1773,Biden orders airstrikes on Iran-backed militias near Iraq-Syria border in response to UAV attacks,0,0.182,0.818,0.0,-0.4404
1774,Biden Budget Would Further Nationalize Police,0,0.0,1.0,0.0,0.0
1775,"Will Biden&amp;apos;s Stimulus fail | President Joe Biden, Stimulus, America, economy, America Rescue Plan",0,0.197,0.618,0.185,-0.0516
