,title,subreddit,neg,neu,pos,compound
0,Biden Must Purge Military and Law Enforcement of White Nationalists,1,0.0,1.0,0.0,0.0
1,"Under Biden, it’s time for Democrats to let go of Medicare for All",1,0.0,1.0,0.0,0.0
2,"Yeah, I am officially Neoliberal now.",1,0.0,0.645,0.355,0.296
3,Joe Biden at noon today,1,0.0,1.0,0.0,0.0
4,"Canada's ambassador to U.S. shares most Biden priorities, worries about his 'Buy America' policy",1,0.177,0.695,0.127,-0.2177
5,"Biden Cultural Marxists have taken over, time to...",1,0.0,1.0,0.0,0.0
6,Joe Biden to issue raft of executive orders after inaugural address,1,0.0,1.0,0.0,0.0
7,"President-elect Joe Biden is expected to sign 15 executive actions upon taking office Wednesday, immediately reversing key Trump administration policies.",1,0.0,1.0,0.0,0.0
8,Biden to overturn Trump order excluding undocumented immigrants from census,1,0.0,1.0,0.0,0.0
9,"Mr. Biden, tear down this wall!",1,0.0,1.0,0.0,0.0
10,"Goodbye Trump, Hello PRESIDENT Biden",1,0.0,1.0,0.0,0.0
11,Biden Has a Peloton Bike. That Raises Issues at the White House.,1,0.0,1.0,0.0,0.0
12,"Joe Biden, Incumbent",1,0.0,1.0,0.0,0.0
13,"""President Biden""",1,0.0,1.0,0.0,0.0
14,American Leadership under Biden is back!,1,0.0,1.0,0.0,0.0
15,Joseph R. Biden Sworn in as the 46th President of the United States,1,0.0,0.811,0.189,0.4215
16,Trump is actually Shadow President. Biden is just a figurehead.,1,0.0,1.0,0.0,0.0
17,"Who’s ready to go to Biden rallies on non election years, and fly Biden flags on the back of our cars and trucks?",1,0.0,0.898,0.102,0.3612
18,5 ideas for Senate filibuster reform Biden and Manchin could get behind,1,0.0,1.0,0.0,0.0
19,"Clyburn said former President Bush said to him today, ""you're the savior."" Bush said to him if it wasn't for him, Biden wouldn't be here today. Bush admitted to Clyburn today that Biden was the ONLY ONE that could defeat Trump.",1,0.069,0.899,0.032,-0.3818
20,"I am celebrating the inauguration by writing a /r/neoliberal /r/ReverendInsanity crossover fanfic, which I have been waiting to post for months",1,0.0,0.821,0.179,0.5719
21,"China sanctions Pompeo, O'Brien, Azar and other Trump administration officials after Biden inauguration",1,0.0,1.0,0.0,0.0
22,Pass Biden the aux cord,1,0.0,1.0,0.0,0.0
23,Mr. Biden,1,0.0,1.0,0.0,0.0
24,Donald Trump attends the inauguration of President Biden,1,0.0,1.0,0.0,0.0
25,"Jim Clyburn: ""George Bush said to me today, ‘You know, you’re the savior because if you had not nominated Joe Biden, we would not be having this transfer of power today’. He said to me that Joe Biden was the only one who could have defeated the incumbent President.”",1,0.061,0.939,0.0,-0.4767
26,Israel warns ‘nothing to discuss’ with Biden if returns to Iran deal as is,1,0.097,0.903,0.0,-0.1027
27,Macron calls on Biden to increase US military presence in Middle East,1,0.0,0.827,0.173,0.3182
28,"Joe Biden and an Antifa activist loot the Godkiller sword from Themyscira [2021, colorized].",1,0.0,1.0,0.0,0.0
29,"Me when my progressive pal says he can't wait for Biden and establishment Democrats to do nothing for four years, while I'm just watching dignity, soul, and competence return to government from the moment Joe uttered his first words into a mic in the spot a thwarted coup all started not long ago.",1,0.021,0.928,0.051,0.3818
30,Donald Trump left a letter for Joe Biden,1,0.0,1.0,0.0,0.0
31,Clyburn: Bush called him a 'savior' for boosting Biden,1,0.0,0.745,0.255,0.34
32,Biden 'is planning to run again' in 2024,1,0.0,1.0,0.0,0.0
33,Joe Biden in 2008,1,0.0,1.0,0.0,0.0
34,"Rouhani says it will be quid pro quo with Biden: If US signs, so will Iran. If US issues order, so will Iran. If US returns to commitments, so will Iran. ""Trump's political life ended today. Trump died but JCPOA lives,"" Rouhani said.",1,0.052,0.92,0.028,-0.2617
35,"Biden became president at noon despite taking oath early, constitutional experts say",1,0.0,1.0,0.0,0.0
36,"President Joe Biden entering the Whitehouse, looking for God (2020, colorized)",1,0.0,0.826,0.174,0.2732
37,"President Biden Issues Most Substantive, Wide-Ranging LGBTQ Executive Order In U.S. History",1,0.0,1.0,0.0,0.0
38,But but I thought Trump was gonna call the military and arrest Biden noooo what's happening !,1,0.195,0.805,0.0,-0.5255
39,‘I’m About to Puke’: QAnon in Chaos as Biden Takes Office,1,0.27,0.73,0.0,-0.5719
40,People on this subreddit hate Bernie Sanders,1,0.381,0.619,0.0,-0.5719
41,Biden poised to be the most pro-immigrant president since Reagan,1,0.0,0.818,0.182,0.25
42,Brazil's Bolsonaro says he wants free trade agreement with U.S. in letter to Biden,1,0.0,0.649,0.351,0.7579
43,"Well guys, Biden is president so I guess politics is over now.",1,0.0,0.826,0.174,0.2732
44,White House says Biden to hold first foreign leader call with Canada's Trudeau on Friday,1,0.0,1.0,0.0,0.0
45,Joe Biden fires anti-union NLRB general counsel after he refuses to resign,1,0.179,0.821,0.0,-0.34
46,Trump Destroyed the Most Important Virtue in America | Biden can help us get it back.,1,0.145,0.498,0.357,0.5678
47,Clyburn says Bush told him he was ‘the savior’ for endorsing Biden.,1,0.0,1.0,0.0,0.0
48,Global stocks march higher after Biden inauguration,1,0.0,1.0,0.0,0.0
49,President Biden holds his grandson Beau Biden tonight at the White House,1,0.0,1.0,0.0,0.0
50,I made a bet that if Biden won the Election I would drink a Corn Pop and Sriracha Smoothie...well,1,0.0,0.791,0.209,0.5719
51,Anti-fascist protesters vandalize Oregon Democrats' office on Biden inaugural day,1,0.174,0.826,0.0,-0.2263
52,"Scorning Biden, protesters in Portland, Ore., and Seattle called for more radical change.",1,0.137,0.863,0.0,-0.2263
53,Biden Revokes Trump's Executive Order 13950 (Combating Race and Sex Stereotyping),1,0.0,1.0,0.0,0.0
54,I know now the thing I missed the most is decency,1,0.216,0.784,0.0,-0.296
55,Joe Biden Wins.,1,0.0,0.351,0.649,0.5719
56,Nate Silver (44.4%) is the most followed political writer by biden administration officials,1,0.0,1.0,0.0,0.0
57,[OC] How Biden spent his first night in the White House,1,0.0,1.0,0.0,0.0
58,"Biden inheriting nonexistent coronavirus vaccine distribution plan and must start 'from scratch,' sources say",1,0.0,1.0,0.0,0.0
59,Biden Unveils a National Pandemic Response That Trump Resisted,1,0.0,1.0,0.0,0.0
60,Biden Agenda for the first 100 days?,1,0.0,1.0,0.0,0.0
61,Americans looking at Joe Biden after he’s inaugurated,1,0.0,1.0,0.0,0.0
62,Why Joe Biden Must Not Shy Away From the Full Power of the Presidency,1,0.0,0.882,0.118,0.1877
63,"Thobes and Daggers: CIA Veterans Assess U.S. Options in Saudi Arabia | How Joe Biden can—and can’t—get rid of the notorious MBS, a man he called a 'thug'",1,0.108,0.892,0.0,-0.4404
64,"Dear Joe Biden, deficits still matter.",1,0.0,0.519,0.481,0.4019
65,Biden in process of canceling GOD!,1,0.0,0.615,0.385,0.481
66,What countries would you regard as the Top 3 priority/preferred partners for the Biden admin?,1,0.0,0.878,0.122,0.2023
67,"They’re saying Antifa, which is an idea that supports Biden, attacked a democrat HQ in Portland and spray-pained F#%£ Biden.",1,0.133,0.756,0.111,-0.128
68,In Photos: The Inauguration of Joe Biden and Kamala Harris — BPN Today News,1,0.0,1.0,0.0,0.0
69,Joe Biden seeks to heal the wounds inflicted by Donald Trump,1,0.0,1.0,0.0,0.0
70,"To heal ‘the broken land,’ as President Biden urged, America must embrace immigrants",1,0.189,0.671,0.14,-0.2023
71,Just a reminder: Joseph „Joe“ Robinette Biden is the 46th president of the United States of American.,1,0.0,0.843,0.157,0.4215
72,Just a reminder: Joseph „Joe“ Robinette Biden is the 46th president of the United States of America.,1,0.0,0.843,0.157,0.4215
73,Where do you disagree with Biden and the Democratic Party?,1,0.195,0.602,0.203,0.0258
74,About Roe v Wade and Barrett,1,0.0,1.0,0.0,0.0
75,Biden immigration bill would give more protections to child migrants,1,0.0,1.0,0.0,0.0
76,Biden Taps a War on Terror Veteran to Stop White Supremacists,1,0.657,0.343,0.0,-0.8885
77,The China trade war is one thing Joe Biden won't be rushing to fix,1,0.231,0.769,0.0,-0.5994
78,Biden revokes Keystone pipeline permit. Good or Bad?,1,0.282,0.484,0.234,-0.1531
79,Dr. Anthony Fauci on Differences Between Trump &amp; Biden Administrations,1,0.0,1.0,0.0,0.0
80,"To Build Back Better, Biden Needs to Fix Trade",1,0.0,0.734,0.266,0.4404
81,Important divide within this sub,1,0.0,0.69,0.31,0.2023
82,Biden wants to remove this controversial word from US laws,1,0.182,0.818,0.0,-0.25
83,New Hampshire - October 2011 | Governor Lynch: Mr. Vice President watch this. *stuffs reporter's mouth with pie* Biden: That's what you call feeding the press.,1,0.0,1.0,0.0,0.0
84,Opinion | Joe Biden May Have Only Two Years to Get Things Done,1,0.0,1.0,0.0,0.0
85,A ‘Nerve Center’ for Climate in the Biden White House,1,0.0,1.0,0.0,0.0
86,Opinion | China threw down the gauntlet to the Biden team on day one,1,0.0,1.0,0.0,0.0
87,"Biden: ""Janet Yellen needs a ""Hamilton"" musical."" Dessa: here you go. - Who's Yellen Now? - Song by Dessa [1:34]",1,0.0,1.0,0.0,0.0
88,Opinion: The Biden Administration is a New Phase in American History — BPN Today News,1,0.0,1.0,0.0,0.0
89,Opinion: The Biden Administration is a New Phase in American History — BPN Today News,1,0.0,1.0,0.0,0.0
90,Biden plans to hold a ‘Climate Leaders’ Summit’ on Earth Day.,1,0.0,1.0,0.0,0.0
91,‘Worse Than We Imagined’: Team Trump Left Biden a COVID Nightmare,1,0.0,1.0,0.0,0.0
92,https://news.sky.com/story/is-joe-biden-woke-boris-johnson-says-theres-nothing-wrong-if-he-is-12193991 Boris Johnson is asked: Is Joe Biden woke?,1,0.0,1.0,0.0,0.0
93,Boris Johnson is asked: Is Joe Biden woke?,1,0.0,1.0,0.0,0.0
94,"Biden Wants to Raise Taxes, Yet Many Trump Tax Cuts Are Here to Stay",1,0.145,0.855,0.0,-0.296
95,Biden To Toss Trump Plan That Would Have Made It Easier To Fire Top Civil Servants,1,0.12,0.65,0.23,0.296
96,Joe Biden combining environmental and foreign policy for bipartisan support,1,0.0,0.769,0.231,0.4019
97,Biden Pledged to Fight White Supremacy. Prominent Conservatives Felt Personally Attacked.,1,0.348,0.435,0.217,-0.4767
98,The biggest step the Biden administration took on climate yesterday wasn't rejoining the Paris Agreement — TechCrunch,1,0.0,0.824,0.176,0.4939
99,Biden cancelling Keystone XL?,1,0.375,0.625,0.0,-0.2023
100,"Senior Democrats drafting plan to give parents $3,000 per child in Biden stimulus",1,0.0,1.0,0.0,0.0
101,"Prosecute Trump? Biden Is Wary, but His Voters Are Eager",1,0.141,0.611,0.248,0.34
102,"BernieBros:""Biden will do nothing for student loan payments in the pandemic!😠"" Biden, literarly just when he gets into power:😎🍦",1,0.0,1.0,0.0,0.0
103,New picture of Joe Biden in tan suit leaked; Republicans say impeachment is on the table,1,0.133,0.867,0.0,-0.3182
104,Trump allies dismissed at VOA as Biden administration names new leadership,1,0.0,1.0,0.0,0.0
105,Biden fires Trump-appointed labor board general counsel and deputy who refused to resign,1,0.295,0.705,0.0,-0.5574
106,The Biden government announced its aggressive intentions just two days later,1,0.138,0.862,0.0,-0.1531
107,Former AKP deputy claims Joe Biden is secretly Kurdish,1,0.0,1.0,0.0,0.0
108,"Has cancel culture gone too far? Ocasio-Cortez suggests Pres. Biden, Sec of Ed be cancelled after pausing student loan debt payments, interest",1,0.236,0.655,0.109,-0.3612
109,"Biden pledged to work with Canada on 'Buy American' during call with Trudeau, official says",1,0.0,1.0,0.0,0.0
110,Biden and Kennedy,1,0.0,1.0,0.0,0.0
111,Meet the New Boss (Predictions for a Biden Presidency &amp; Trump's Future),1,0.0,1.0,0.0,0.0
112,Twitter suspends Antifa accounts following the recent attack on DNC headquarters in Seattle and Portland in protest against the inauguration of Biden administration.,1,0.195,0.805,0.0,-0.6249
113,Impeachment trial could knock Biden virus aid plan off course,1,0.0,1.0,0.0,0.0
114,"As Joe Biden acts, Scott Morrison stays silent on QAnon connections",1,0.0,1.0,0.0,0.0
115,"For the first time in three decades, the US has elected an 'insider' and it's already making a big difference.",1,0.0,1.0,0.0,0.0
116,It looks like Biden might put troops back into Iraq. IDK about you and I know this is the unpopular take on this sub but we should NOT go back. Stay out of the Middle East,1,0.043,0.909,0.048,0.0473
117,How would you convert Alaska into a blue state? And what is the future of the Alaskan economy.,1,0.0,1.0,0.0,0.0
118,I hate Kamala Harris so much that I have become a Biden supporter simply for the fact that I want him to live through his term so Kamala never has the satisfaction of being president,1,0.167,0.74,0.093,-0.5727
119,Janet Yellen's stance on Crypto-Currencies is disgraceful and encourages a tyrannical Surveillance State,1,0.0,0.791,0.209,0.4404
120,"Biden responding to a Turning point nut when asked how many genders there are: ""At least three... don't play games with me, kid""",1,0.088,0.912,0.0,-0.2584
121,"Biden signs executive orders on stimulus checks, food stamps and minimum wage",1,0.0,1.0,0.0,0.0
122,What is NeoLiberalism?,1,0.0,1.0,0.0,0.0
123,"In order to help Biden unify America, we should create a subreddit where political enemies compliment each other to encourage unity &amp; comradeship",1,0.102,0.541,0.357,0.7906
124,Is an eviction moratorium is a good idea?,1,0.275,0.459,0.266,-0.0258
125,Anand Giridharadas: Fox News Shouldn't Be Allowed To Exist,1,0.0,1.0,0.0,0.0
126,Rand Paul: Biden hates Black teens for pushing a $15 minimum wage,1,0.225,0.775,0.0,-0.4404
127,Q is dead!,1,0.821,0.179,0.0,-0.68
128,Biden won't accomplish anything in his presidency,1,0.28,0.72,0.0,-0.3252
129,What did Joe Biden do today?,1,0.0,1.0,0.0,0.0
130,Boris on the phone with Joe Biden,1,0.0,1.0,0.0,0.0
131,Joe Biden halts drilling in Arctic refuge,1,0.0,1.0,0.0,0.0
132,$15 Minimum Wage Subverts Biden Recovery Plan,1,0.0,1.0,0.0,0.0
133,Questions about Biden’s stimulus plan from a leftie,1,0.0,1.0,0.0,0.0
134,Joe Biden Administration Future Compass (by @WoodlouseM on Twitter),1,0.0,1.0,0.0,0.0
135,Joe Biden Lifted His Health Care Plan From Insurance Industry Lobbyists,1,0.0,0.758,0.242,0.4939
136,Read the Jerusalem Post article it mentions nothing about Biden potentially dropping 1000s of American troop on Iraq soil.,1,0.0,1.0,0.0,0.0
137,Biden Team Promises New Look in Trade Policy,1,0.0,0.729,0.271,0.3818
138,Biden says his mask mandate is common sense. Republicans say ‘kiss my ass.’ | The president’s first executive order already has opponents. Is it a harbinger of things to come?,1,0.0,1.0,0.0,0.0
139,Biden to end support for the Saudi-led coalition in Yemen,1,0.0,0.769,0.231,0.4019
140,Biden reportedly bonded with UK leader Boris Johnson over their mutual love of trains,1,0.0,0.756,0.244,0.6369
141,Biden is leading the return to DC Brunch,1,0.0,1.0,0.0,0.0
142,The Biden administration must go into overdrive to reclaim our courts,1,0.0,1.0,0.0,0.0
143,Why would Biden do this?,1,0.0,1.0,0.0,0.0
144,"Biden and Boris Johnson talk alliance, climate, Covid",1,0.0,1.0,0.0,0.0
145,How would you rate the presidency of Volodymyr Zelensky (Ukraine)?,1,0.0,1.0,0.0,0.0
146,"Five examples of media's sycophancy for Biden on inauguration week (Some valid points, even though I think the right wing media is worse)",1,0.0,1.0,0.0,0.0
147,The difference between the Obama 2012 and Biden 2020 coalition in Minnesota (roughly equal statewide margin),1,0.0,1.0,0.0,0.0
148,"Bipartisan group of senators pushes back on Biden Covid plan - On a call with White House officials, senators objected to stimulus payments to wealthy Americans.",1,0.0,0.902,0.098,0.3612
149,Biden to repeal Trump's ban on transgender people joining military,1,0.286,0.714,0.0,-0.5574
150,Column: Joe Biden is the worst president I’m history and he’s turning my dog into a socialist,1,0.215,0.785,0.0,-0.6249
151,Joe Biden and Emmanuel Macron pledge to strengthen ties in first phone call,1,0.0,0.839,0.161,0.3182
152,Biden to Convene World Leaders to Talk Climate on Earth Day,1,0.0,1.0,0.0,0.0
153,Biden Promise Tracker - The 100 most important campaign promises of President Joseph R. Biden,1,0.0,0.603,0.397,0.7397
154,Biden Aims To Close Loopholes In Federal 'Buy American' Provisions,1,0.0,1.0,0.0,0.0
155,"JOE BIDEN hasn't passed "" "" he is trump 2.0",1,0.0,1.0,0.0,0.0
156,Taiwan’s embrace of Trumpism &amp; what the backsliding Asian democracies mean for the liberal world order,1,0.0,0.867,0.133,0.3182
157,Biden to sign order aimed at pushing federal government to buy American-made products,1,0.0,1.0,0.0,0.0
158,Biden set for ‘buy American’ push to boost domestic manufacturing,1,0.0,0.769,0.231,0.4019
159,Joe Biden Has a Europe Problem,1,0.403,0.597,0.0,-0.4019
160,Biden to approach U.S.-China relations with 'patience': White House spokeswoman,1,0.0,1.0,0.0,0.0
161,Republicans plan voting overhauls after Biden win,1,0.0,0.612,0.388,0.5859
162,Biden amlo alliance? 😳,1,0.0,1.0,0.0,0.0
163,Biden issues 1.9 trillion in Tubman Twenties.,1,0.0,1.0,0.0,0.0
164,When’s Biden going to make good on his campaign promises?,1,0.0,0.593,0.407,0.6705
165,"Pres. Biden: ""The federal government also owns an enormous fleet of vehicles, which we're going to replace with clean electric vehicles made right here in America, by American workers.""",1,0.0,0.912,0.088,0.4019
166,"Whats with Canada being upset at Biden for the keystone pipe cancel and buy American aren't they always dabbing on the US for being ""better""",1,0.167,0.833,0.0,-0.5574
167,"My response and criticism to ""Taiwan's embrace of Trumpism""",1,0.238,0.574,0.189,-0.1531
168,Biden plans to replace government fleet with electric vehicles,1,0.0,1.0,0.0,0.0
169,neolibs when Biden signed Buy American,1,0.0,1.0,0.0,0.0
170,WA Post Fact Checker admits they won't be fact checking Biden claims. Is this a good thing?,1,0.0,0.715,0.285,0.6783
171,"Biden more bullish on vaccines, open to 1.5M daily shot goal",1,0.0,1.0,0.0,0.0
172,"Yellen says Biden is ""fully supportive"" of carbon pricing",1,0.0,0.762,0.238,0.3597
173,Biden Raises Daily Vaccination Target and Extends Travel Bans,1,0.0,0.842,0.158,0.128
174,A Brief History of the Calico Acts: How Protectionism ruined the British Textile Industry and How Free Trade Saved it.,1,0.123,0.635,0.242,0.4588
175,President Biden speaks with NATO | YouTube,1,0.0,1.0,0.0,0.0
176,Social justice groups warn Biden against throwing out Section 230,1,0.109,0.625,0.266,0.4588
177,Thoughts on Biden so far?,1,0.0,1.0,0.0,0.0
178,Biden is our first gamer president,1,0.0,1.0,0.0,0.0
179,Biden pitching a much vaster climate plan than Obama ever attempted,1,0.0,1.0,0.0,0.0
180,"Biden Appoints New Cabinet Secretaries, Ousting Trump Loyalists",1,0.0,0.769,0.231,0.2732
181,"President Biden to Sign Executive Order, Pausing Oil and Gas Leasing",1,0.0,1.0,0.0,0.0
182,Biden begins staffing commission to study Supreme Court reform: report,1,0.0,0.714,0.286,0.5574
183,"hey guys, i’m an ex republican who voted for biden and blue down the ballot after almost two decades of voting red. a friend pointed me to this sub and i just wanna know how things go here if that’s cool?",1,0.0,0.871,0.129,0.6705
184,Is there a resource out there that shows all the things the Biden administration have already done since the inauguration?,1,0.0,1.0,0.0,0.0
185,Why President Biden could put the TPP back on the table,1,0.0,1.0,0.0,0.0
186,Joe Biden stresses U.S. commitment to defend Japan in first call with Suga,1,0.181,0.663,0.157,-0.1027
187,Biden can rescue the Nuclear Regulatory Commission from industry capture - Bulletin of the Atomic Scientists,1,0.0,0.809,0.191,0.5106
188,How Popular Is Joe Biden? - 538 Released Their Approval Rating Tracker For Biden,1,0.0,0.651,0.349,0.7096
189,"Biden delays orders to reverse Trump-era immigration changes, create task force for separated families",1,0.0,0.861,0.139,0.2732
190,‘Taiwan independence means war’: China’s defence ministry warns Joe Biden against siding with Taipei,1,0.095,0.811,0.095,0.0
191,USA President Joe Biden Dance..! (meme),1,0.0,1.0,0.0,0.0
192,Federal Judges Are Retiring Now That Joe Biden Will Pick Their Replacements,1,0.0,1.0,0.0,0.0
193,"Yes, President Biden signed more executive orders in his first week than any past president",1,0.0,0.838,0.162,0.4019
194,Editorial: Biden can stop the migrant caravans. Here's how.,1,0.216,0.784,0.0,-0.296
195,Biden Admin Issues 30+ Drilling Permits,1,0.0,1.0,0.0,0.0
196,How popular is Joe Biden?,1,0.0,0.588,0.412,0.4215
197,Biden: The First Post-Reagan Presidency,1,0.0,1.0,0.0,0.0
198,Europe gives Biden a one-finger salute,1,0.0,1.0,0.0,0.0
199,"Nancy Pelosi Buys Tesla Calls, Stands To Benefit From New Biden EV Plan",1,0.0,0.8,0.2,0.4588
200,Is this the unity that Biden was talking about?,1,0.0,1.0,0.0,0.0
201,Biden wants to triple protected lands,1,0.0,0.633,0.367,0.4404
202,Op-Ed: I called Arizona for Biden on Fox News. Here's what I learned,1,0.0,1.0,0.0,0.0
203,'One more check is not enough': 54 progressive Democrats urge Biden to add recurring direct payments to COVID-19 relief package,1,0.0,0.86,0.14,0.4767
204,"Dear Representative Valadao, you should drop the GOP.",1,0.196,0.561,0.243,0.128
205,Career Deregulator Cass Sunstein joins the Biden Cabinet,1,0.0,1.0,0.0,0.0
206,"Biden killed the Keystone Pipeline. Good, but he doesn't get a climate pass just yet | Biden administration",1,0.147,0.749,0.104,-0.2023
207,"Pictures of Biden and Harris on the wall of the office in Poznań. ""Good luck, Mr. President"" https://www.polsatnews.pl/wiadomosc/2021-01-19/zdjecia-bidena-i-harris-na-scianie-urzedu-w-poznaniu-powodzenia-panie-prezydencie/",1,0.0,0.731,0.269,0.7096
208,Pictures of Biden and Harris at the entrance to the marshal's office,1,0.0,1.0,0.0,0.0
209,Would Biden's getting his agenda passed effectively close and invert the current US-EU salary differential and allow Europe to overtake the US?,1,0.0,0.806,0.194,0.5859
210,Biden officially further left than Trudeau lmfao,1,0.0,0.632,0.368,0.5423
211,Biden Withdraws Trump Rule That Would Require People to 'Prove' Their Disability,1,0.0,1.0,0.0,0.0
212,How leftist thinks Biden is,1,0.0,1.0,0.0,0.0
213,"A full analysis of demographic voting trends, and what this tells us about the future.",1,0.0,1.0,0.0,0.0
214,Joe Biden training to abolish malarkey,1,0.0,1.0,0.0,0.0
215,Bomb it all.,1,0.615,0.385,0.0,-0.4939
216,Sen. Capito joins other leaders to introduce bill to block Biden energy plan,1,0.181,0.688,0.131,-0.2023
217,"Ten Senate Republicans propose compromise covid relief package, request meeting with Biden",1,0.0,0.78,0.22,0.4767
218,10 Senate Republicans seek meeting with Biden on Covid relief,1,0.0,0.744,0.256,0.4767
219,"10 Republican senators present Biden with smaller Covid stimulus proposal, call for compromise",1,0.0,1.0,0.0,0.0
220,Congress 102: The Very Very Very Start of Understanding the Senate,1,0.0,1.0,0.0,0.0
221,Biden Administration Has Some Cannabis Professionals Feeling Hopeful But Cautious,1,0.133,0.583,0.283,0.2023
222,What Ulysses Grant Can Teach Joe Biden About Putting Down Violent Insurrections,1,0.238,0.61,0.152,-0.34
223,"As Biden Plans Global Democracy Summit, Skeptics Say: Heal Thyself First",1,0.123,0.877,0.0,-0.1027
224,Biden invites GOP senators to White House for relief talks,1,0.0,0.744,0.256,0.4767
225,Joe Biden and the Georgia democrats lied about the stimulus check,1,0.206,0.794,0.0,-0.3818
226,Joe Biden and the Georgia democrats liked about the stimulus check,1,0.0,0.781,0.219,0.4215
227,Biden agrees to meeting with GOP senators on Covid relief - POLITICO,1,0.0,0.647,0.353,0.5994
228,What the Data Say About How Biden Should Govern,1,0.0,1.0,0.0,0.0
229,Why does the far left call Obama-Biden war criminals and hate Kamala for being a prosecutor?,1,0.485,0.515,0.0,-0.9062
230,How are we not ****ed?,1,0.0,1.0,0.0,0.0
231,How would you rate the premiership of Ion Chicu (Moldova)?,1,0.0,1.0,0.0,0.0
232,Nation shocked after Biden able to undo all four hours of work Trump did as President,1,0.133,0.867,0.0,-0.3182
233,Joe Biden could push through $2000 checks with Budget Reconciliation and he wouldn't need one Republican vote to do it. Ask yourself why he isn't.,1,0.0,1.0,0.0,0.0
234,Fax machine extraordinaire on the Republican “compromise” relief plan,1,0.0,0.721,0.279,0.4767
235,Proof Joe Biden is a Radical Liberal Socialist Antifa!! Based Biden?,1,0.0,1.0,0.0,0.0
236,"Biden, in first trade move, reimposes a Trump tariff",1,0.0,1.0,0.0,0.0
237,Biden doesn’t buy GOP’s Covid pitch,1,0.0,1.0,0.0,0.0
238,The case for the TPP,1,0.0,1.0,0.0,0.0
239,What do rurals really want?,1,0.0,0.715,0.285,0.1513
240,"Biden calls Democrats, urges big COVID-19 relief bill",1,0.0,0.693,0.307,0.4767
241,Biden announces efforts to reunite migrant families separated by Trump administration,1,0.0,1.0,0.0,0.0
242,"Why A Biden Blowout Didn’t Happen (And Why A 2024 Blowout Is Unlikely, Too)",1,0.0,1.0,0.0,0.0
243,Singing The Irrawaday Blues: The Tatmadaw Overthrows Democracy in Myanmar,1,0.0,1.0,0.0,0.0
244,Biden administration prepares to open overflow facility for migrant children,1,0.0,1.0,0.0,0.0
245,Kosovo artist creates Joe Biden portrait using grains and seeds,1,0.0,0.811,0.189,0.2732
246,Biden-led financial regulators get ready to crack the whip,1,0.0,0.762,0.238,0.3612
247,"I guess Biden IS my president. And it's weird, because I am Ukrainian",1,0.145,0.855,0.0,-0.1779
248,Biden tells House Democrats to 'stick together' in Covid-19 relief push,1,0.0,0.763,0.237,0.4767
249,"Biden says he won’t drop his ‘promise’ for $1,400 stimulus checks, but is open to further targeting them.",1,0.084,0.916,0.0,-0.1406
250,Joe Biden may already be turning down the temperature of American politics,1,0.0,1.0,0.0,0.0
251,Dems should severally limit the power of the president in the next 2 years.,1,0.0,1.0,0.0,0.0
