,title,subreddit,neg,neu,pos,compound
971,Biden to waive sanctions on Putin crony in charge of Nord Stream 2 pipeline,1,0.0,1.0,0.0,0.0
972,Biden driving the new electric F-150...,1,0.0,1.0,0.0,0.0
973,Biden guns it in Ford's new electric truck,1,0.0,1.0,0.0,0.0
974,Biden said pressuring Netanyahu to end Gaza fighting within days,1,0.38,0.62,0.0,-0.5994
975,Biden test drives Ford’s new electric F-150,1,0.0,1.0,0.0,0.0
976,Biden to waive sanctions on Putin crony in charge of Nord Stream 2 pipeline,1,0.0,1.0,0.0,0.0
977,It’s Time for Biden to Ratchet Up the Pressure on the WHO,1,0.167,0.833,0.0,-0.296
978,Biden jokingly threatens to run over a reporter asking about Israel as he test-drives new electric Ford truck,1,0.14,0.86,0.0,-0.3818
979,GOP and Biden infrastructure talks yield minimal progress,1,0.0,0.714,0.286,0.4215
980,Biden administration decides not to sanction company building controversial Russian gas pipeline,1,0.141,0.859,0.0,-0.2023
981,"I kinda know the answer, but I also really want to know: why hasn't Biden called on a ceasefire?",1,0.0,0.888,0.112,0.2238
982,Biden tells Israel’s Netanyahu U.S. expects ‘a significant de-escalation today’ in Gaza,1,0.0,0.859,0.141,0.2023
983,What changes has Biden made to our immigration system? And what other changes has he proposed?,1,0.0,1.0,0.0,0.0
984,"""Steel trade groups, union call on Biden to leave tariffs intact"" Can unions in the US coexist with free trade??",1,0.051,0.719,0.231,0.644
985,Nord Stream 2: Biden waives US sanctions on Russian pipeline,1,0.0,1.0,0.0,0.0
986,Israeli Prime Minister Benjamin Netanyahu rejects Biden call for ‘significant de-escalation’ in Gaza conflict,1,0.314,0.686,0.0,-0.6705
987,Biden calls off key sanctions on Russian pipeline as Blinken holds first meeting with Moscow,1,0.0,1.0,0.0,0.0
988,Biden selects transgender doctor Rachel Levine as assistant health secretary. An over weight cross dresser with mental health issues.,0,0.0,1.0,0.0,0.0
989,“Biden campaign calls China's treatment of Uighur Muslims 'genocide' and pressures Trump to take action”-143 days ago,0,0.126,0.874,0.0,-0.3182
990,"Hey, r/politics nutjobs who attribute covid deaths to Trump",0,0.0,1.0,0.0,0.0
991,Biden Harris’ Inauguration &amp; America's Obsession with Celebrities,0,0.255,0.745,0.0,-0.34
992,Dear shills of r/Libertarian,0,0.0,0.536,0.464,0.3818
993,"Whether it’s the Trump or Biden administration, there should never be any restriction on lobbying congress or the executive branch, as it imposes a federal restriction on free speech",0,0.083,0.705,0.212,0.6402
994,"Prediction: There will be no prosecution of Trump, and Biden calling for ""unity"" will be used as the excuse.",0,0.238,0.705,0.057,-0.6249
995,So what happened? Trump is gone. Biden is being sworn. What about all of those MAGA threats? CRICKETS....chirp chirp chirp...not a peep out of a single cultist.,0,0.116,0.884,0.0,-0.4871
996,The ceremony is very fitting...,0,0.0,1.0,0.0,0.0
997,Upvote for Biden Win and more Mandates!,0,0.0,0.595,0.405,0.6239
998,Joe Biden is president!,0,0.0,1.0,0.0,0.0
999,What a shame🙎‍♂️,0,0.0,1.0,0.0,0.0
1000,"FLASHBACK: Vice President Joe Biden Eulogizes Former KKK Member, Robert Byrd - July 2, 2010",0,0.0,1.0,0.0,0.0
1001,Will Joe Biden Destroy Trump's Legacy of Deregulation?,0,0.333,0.667,0.0,-0.5423
1002,So now this sub is going to do nothing rip on the Biden administration right?,0,0.0,1.0,0.0,0.0
1003,"Horrified Biden Family Discovers Rotting, Months-Old Corpse Of Jeff Sessions In White House Executive Residence",0,0.356,0.644,0.0,-0.802
1004,"Biden intel community “are moving in laser-like fashion to try to uncover as much as they can about” the pro-Trump “insurgency” that harbors “religious extremists, authoritarians, fascists, bigots, racists, nativists, even libertarians”",0,0.15,0.85,0.0,-0.6486
1005,Biden and Harris' greatest act of unity,0,0.0,0.588,0.412,0.6369
1006,President Biden is wasting no time signing executive orders. 15 on his first day with more to come in the next few weeks.,0,0.189,0.811,0.0,-0.5994
1007,John Brennan: The Biden admin and intelligence agencies are moving with “laser like focus” to “root out” extremist groups like libertarians,0,0.0,0.649,0.351,0.802
1008,"Biden rescinds Trump’s emergency declaration on border security, halts border wall construction",0,0.173,0.667,0.16,-0.0516
1009,"Amazon congratulates Biden, offers to help with vaccine distribution (and people have thoughts). Is this just convenient timing? Or is Amazon responsible for part of the death toll by withholding this kind of support?",0,0.091,0.65,0.259,0.6448
1010,Biden is president! We are free at last!,0,0.0,0.643,0.357,0.5972
1011,Trump's Immigration Policy Was Brutal and Inhumane. Will Biden Fix It?,0,0.291,0.709,0.0,-0.6249
1012,"I didn’t vote for Biden, but want him to succeed in righting the train wreck of US democracy. The carnage has to stop here and now (op-ed by Scott Ritter)",0,0.178,0.668,0.154,-0.2263
1013,"People are protesting in Seattle and chanting ""F Trump and Biden too""",0,0.203,0.797,0.0,-0.4215
1014,"‘Where were you a month ago?’ With Trump gone, Amazon greets Biden with offer to help speed distribution of Covid-19 vaccines",0,0.0,0.739,0.261,0.6124
1015,Global Warming Hardliners John Legend and Chrissy Teigen Took Private Jet to Biden Inauguration,0,0.0,0.89,0.11,0.1531
1016,A Conservative’s Guide to Preparing for a Biden Presidency,0,0.0,1.0,0.0,0.0
1017,"John Brennan says Biden administration is targeting libertarians, along with, religious extremists, authoritarians, fascists, bigots, racists, nativists",0,0.26,0.686,0.054,-0.6369
1018,"Libertarians, what are you actually expecting from Biden?",0,0.0,0.864,0.136,0.0258
1019,It is official. We are enemies of the people,0,0.286,0.714,0.0,-0.4939
1020,Executive orders are a cancer on our democracy,0,0.423,0.577,0.0,-0.6597
1021,So what are we all expecting from a Biden presidency?,0,0.0,1.0,0.0,0.0
1022,"""Even Libertarians"": John Brennan Issues 'List' Of Ideologies Biden Intel Community Should Go After",0,0.0,1.0,0.0,0.0
1023,"I imagine that this Sub wouldn't be a huge fan of Biden and a lot of his policies... So why do I see so many people here saying that he's ""our best chance in a long time""?",0,0.103,0.734,0.163,0.5067
1024,All The Jews Biden Has Tapped For Top Roles In His New Administration,0,0.0,0.87,0.13,0.2023
1025,A New America Is Born As Joe Biden is Inaugurated 46th President without Donald Trump,0,0.0,1.0,0.0,0.0
1026,Gun control,0,0.706,0.294,0.0,-0.34
1027,"""Even Libertarians"": John Brennan Issues 'List' Of Ideologies Biden Intel Community Should Go After. (We'll that didn't take long.)",0,0.0,1.0,0.0,0.0
1028,What do you guys think of Biden's day one EOs?,0,0.0,1.0,0.0,0.0
1029,If you supported Trump or now support Biden then you are not a libertarian...,0,0.0,0.688,0.312,0.6124
1030,"'No plan, no Q, nothing': QAnon followers reel as Biden inaugurated",0,0.328,0.672,0.0,-0.5267
1031,"Farewell, Mr. Trump",0,0.0,1.0,0.0,0.0
1032,Biden's national debt is the highest in history,0,0.263,0.737,0.0,-0.3612
1033,Krystal and Saagar: John Brennan Says Biden Intel ALREADY Ramping Up Domestic Surveillance,0,0.0,1.0,0.0,0.0
1034,Biden Has Already Fired Three of Trump’s Worst Appointees,0,0.524,0.476,0.0,-0.8271
1035,Biden inheriting nonexistent coronavirus vaccine distribution plan and must start 'from scratch',0,0.0,1.0,0.0,0.0
1036,John Brennan: Biden Intelligence Agencies To Investigate Pro-Trump ‘Bigots’ And ‘Libertarians’,0,0.0,0.763,0.237,0.4767
1037,Biden to pardon Snowden and Assange.,0,0.0,0.685,0.315,0.3182
1038,Me and my brother fixed minimum wage yesterday while playing Minecraft. (I just need someone to get this to Biden),0,0.0,0.913,0.087,0.2023
1039,"Biden intel community “are moving in laser-like fashion to try to uncover as much as they can about” the pro-Trump “insurgency” that harbors “religious extremists, authoritarians, fascists, bigots, racists, nativists, even libertarians”",0,0.15,0.85,0.0,-0.6486
1040,Biden Set To Entrench Trumpist Protectionism With 'Buy American' Order,0,0.0,1.0,0.0,0.0
1041,"John Brennan: Biden ""Nominees and Appointees Are Moving in Laser-Like Fashion"" To Target and ""Root-Out"" Political Opposition, Including Libertarians - The Last Refuge",0,0.0,0.95,0.05,0.0258
1042,"Tennessee mayor lowers flag for Biden inauguration, says town is grieving",0,0.348,0.652,0.0,-0.5859
1043,Georgia congresswoman Marjorie Taylor Greene files articles of impeachment against Biden,0,0.0,1.0,0.0,0.0
1044,Joe Biden Doesn't Want to Be Another 'Deporter in Chief',0,0.12,0.88,0.0,-0.0572
1045,John Brennan: Biden Intelligence Agencies To Investigate Pro-Trump ‘Bigots’ And ‘Libertarians’,0,0.0,0.763,0.237,0.4767
1046,Biden unveils Covid-19 plan based on 'science not politics' as he signs new initiatives,0,0.0,1.0,0.0,0.0
1047,Libertarianism on alternate social media platforms,0,0.0,0.781,0.219,0.1027
1048,"Chris Rufo: Biden has reinstated critical race theory in the federal government. In response, we have launched a campaign to file lawsuits against schools, corporations, and government agencies that teach the principles of race essentialism, collective guilt, and neo-segregation.",0,0.145,0.819,0.036,-0.5423
1049,Joe Biden makes me want to kill myself,0,0.392,0.5,0.108,-0.6597
1050,"No Mask, No Fly: Biden Signs Order Requiring Face Coverings On Planes",0,0.306,0.694,0.0,-0.5267
1051,Biden seeks $15/hr min. wage for federal workers,0,0.0,1.0,0.0,0.0
1052,I think civil war is less likely,0,0.438,0.562,0.0,-0.5994
1053,Why I don't agree with voter fraud arguments in the USA as they are currently presented,0,0.418,0.582,0.0,-0.8229
1054,Biden is already lying to the press,0,0.362,0.638,0.0,-0.5267
1055,Biden Tells Freezing Troops Sleeping In Garages To Be Patient Until He Can Get Them Shipped To Iraq,0,0.076,0.924,0.0,-0.1027
1056,Joe Biden May Have Only Two Years to Get Things Done,0,0.0,1.0,0.0,0.0
1057,Joe Biden Reverses Anti Discrimination Law,0,0.315,0.685,0.0,-0.3182
1058,Biden Broke His Own Rule,0,0.412,0.588,0.0,-0.4215
1059,"Sycophantic pundits compare Biden to God, call him the nation’s new father, and say ‘cleansing’ is underway",0,0.0,0.884,0.116,0.2732
1060,Sensationalism has stripped the Democratic Party of all credibility,0,0.0,0.748,0.252,0.4019
1061,EFF (Electronic Frontier Foundation) Transition Memo to Incoming Biden Administration,0,0.0,1.0,0.0,0.0
1062,Hmmmm?,0,0.0,1.0,0.0,0.0
1063,"""Blatant Nepotism"" -- Rep Marjorie Greene files articles of impeachment against BIDEN",0,0.0,1.0,0.0,0.0
1064,Meet the New Boss (Predictions for a Biden Presidency &amp; Trump's Future),0,0.0,1.0,0.0,0.0
1065,“Biden sticks to vaccine goals nearly met by his predecessor”,0,0.0,1.0,0.0,0.0
1066,Biden administration weighs turning over Trump tax returns to House Democrats,0,0.0,1.0,0.0,0.0
1067,Amash on Biden admitting there's nothing he can do to change the outcome of the pandemic.,0,0.0,1.0,0.0,0.0
1068,"Biden Wants to Raise Taxes, Yet Many Trump Tax Cuts Are Here to Stay",0,0.145,0.855,0.0,-0.296
1069,"No, Biden administration didn’t label Libertarians terrorists",0,0.553,0.351,0.096,-0.7351
1070,Biden says nothing can change the trajectory of the Covid pandemic over the next several months,0,0.0,1.0,0.0,0.0
1071,"""I AGREE WITH YOU..."" Biden Nominee STUNS Rand Paul in Senate Confirmation Hearing *Anthony Blinken*",0,0.0,0.72,0.28,0.6207
1072,BREAKING: New Biden hire allowed Washington state to be defrauded out of millions by Nigerian scammers,0,0.0,1.0,0.0,0.0
1073,Biden claimed in October that he had a plan to get COVID under control. Now he says there is nothing we can do in the next few months,0,0.0,1.0,0.0,0.0
1074,Why wouldn't you do it for all kids?,0,0.0,1.0,0.0,0.0
1075,"Biden: ""the mask mandate only applies to the slaves"".",0,0.0,1.0,0.0,0.0
1076,Why do some Libertarians want open borders?,0,0.0,0.676,0.324,0.1027
1077,Rand Paul: Push for $15 minimum wage shows Biden hates Black teens,0,0.209,0.791,0.0,-0.4404
1078,Introducing /r/BidenWatch - A subreddit dedicated to logging the misdeeds of Joe Biden,0,0.0,0.769,0.231,0.4588
1079,Trump or Biden?,0,0.0,1.0,0.0,0.0
1080,Joe Biden Unites The Uniting Unifiers Of Unity (YTP),0,0.0,1.0,0.0,0.0
1081,Biden Administration Announces Plan to Combat 'Domestic Extremism',0,0.255,0.745,0.0,-0.34
1082,Re-edited the inauguration juxtaposing the American pantomime bs with the American nightmare... Katy Perry singing firework for biden 2021.,0,0.0,1.0,0.0,0.0
1083,"Obama's CIA Director, John Brennan: ""Members of the Biden team moving in laser like fashion to uncover insurgency movements, even libertarians"".",0,0.0,0.889,0.111,0.3612
1084,America Is Complicit in Yemen Atrocities. Biden Says That Ends Now,0,0.0,1.0,0.0,0.0
1085,Biden erasing women’s sports. Well done Biden supporters. Day one and you are really showing everyone.,0,0.0,0.737,0.263,0.6124
1086,What is the Libertarian View on JoJo,0,0.0,0.759,0.241,0.2263
1087,Don't Pack the Courts (Joe Biden shouldn't repeat FDR's big mistake).,0,0.0,1.0,0.0,0.0
1088,Fact Check: Biden did NOT label Libertarians as Terrorists,0,0.425,0.575,0.0,-0.6339
1089,"WATCH as federal agents, 'under orders of Joe Biden', attack and disappear American citizen (we do this right, mainstream media?)",0,0.217,0.783,0.0,-0.6124
1090,Trump and Biden are both authoritarian dicks.,0,0.0,1.0,0.0,0.0
1091,Biden pushes elusive 'Buy American' goal with new federal contract guidelines,0,0.0,1.0,0.0,0.0
1092,Biden Nominee Rachel Levine Was a Disaster in Pennsylvania. Now She's Headed to Washington.,0,0.255,0.745,0.0,-0.6249
1093,"Biden to increase H1B visa limit, remove green card quota",0,0.0,0.796,0.204,0.3182
1094,"Biden Administration Suspends Trump Executive Order to Lower Insulin, Epinephrine Prices",0,0.18,0.82,0.0,-0.296
1095,So much for Biden stopping the unidentifiable people from grabbing protesters....,0,0.138,0.862,0.0,-0.1531
1096,"Biden Supports Jones Act Shipping With New ""Buy American"" Order",0,0.0,0.783,0.217,0.3612
1097,Biden reverses Trump's transgender military ban,0,0.419,0.581,0.0,-0.5574
1098,"Missouri Gun Shop Refuses To Sell Weapons, Ammo To Biden Supporters, And They’re Very Upset",0,0.371,0.498,0.131,-0.6478
1099,Biden national security advisor calls for Russia to immediately release detained Putin critic Navalny,0,0.264,0.604,0.132,-0.34
1100,‘What changed?’ Conservatives suspicious after California Gov. Newsom eases lockdown following Biden inauguration,0,0.158,0.696,0.146,-0.0516
1101,Biden Ends Trump's Ban on Trans Troops,0,0.375,0.625,0.0,-0.5574
1102,Joe Biden overturns Trump ban on transgender people joining US military.,0,0.265,0.735,0.0,-0.5574
1103,Biden plans to limit private prisons and transfer of military equipment to police,0,0.0,1.0,0.0,0.0
1104,Biden plans to limit private prisons and transfer of military equipment to police,0,0.0,1.0,0.0,0.0
1105,Biden Signs Another Four Executive Orders In Quest Of ‘Racial Equity’; Ben Carson Responds,0,0.0,1.0,0.0,0.0
1106,"Tulsi: Calls for Biden to embrace ""KGB-style"" tactics in U.S is far scarier than Capitol riot.",0,0.181,0.704,0.116,-0.3182
1107,"Biden freezes F-35 sale to UAE, munitions sales to Saudi Arabia",0,0.099,0.901,0.0,-0.0258
1108,The only difference between democracy and dictatorship is that a minority is oppressed instead of the majority.,0,0.171,0.829,0.0,-0.4767
1109,Biden bans linking COVID-19 to China in bid to quell racist backlash in US,0,0.235,0.765,0.0,-0.6124
1110,Biden to end $40 billion a year Fossil Fuel Subsidies,0,0.0,1.0,0.0,0.0
1111,The United States Should Give Up On Improved Economy Under Democrat Majority,0,0.0,0.629,0.371,0.7096
1112,30 Executive Orders in 7 days. Who’s the dictator?,0,0.0,1.0,0.0,0.0
1113,Biden Looking Into Turning SCOTUS Into A Rubberstamp For His Tyranny,0,0.0,1.0,0.0,0.0
1114,President Biden Should Tell Chicago Teachers To Return to School. At what point should we demand our tax money back?,0,0.073,0.927,0.0,-0.128
1115,Biden Continues Reading ‘The Pet Goat’ To Schoolchildren After Being Informed Of GameStop Situation,0,0.0,1.0,0.0,0.0
1116,"Gird Your Loins, Libertarians. The Biden Admin Is Going to Be Keeping an Eye on You.",0,0.0,0.932,0.068,0.0258
1117,Biden faces scrutiny over reliance on executive orders,0,0.0,1.0,0.0,0.0
1118,"When Biden ""Creates Jobs"" Look for the Hidden Costs",0,0.0,0.792,0.208,0.2732
1119,Why I now support Joe Biden,0,0.0,0.597,0.403,0.4019
1120,Career Deregulator Cass Sunstein joins the Biden Cabinet,0,0.0,1.0,0.0,0.0
1121,"COVID-19 Deaths Under Biden Reach 34,550. Total U.S. Deaths is at 436,819. When Trump Left Office it was at 402,269.",0,0.0,0.945,0.055,0.0258
1122,About the GME fiasco...,0,0.0,1.0,0.0,0.0
1123,Let's talk about Biden and oil jobs....,0,0.0,1.0,0.0,0.0
1124,"Kevin McCarthy on Twitter: ""President Biden told us he would have a plan to defeat the virus on day 1. He just never told us that it would be to give the vaccine to terrorists before most Americans.""",0,0.169,0.831,0.0,-0.7964
1125,Montana ACLU Threatens State's Federal Funding Over Biden Trans Order,0,0.224,0.776,0.0,-0.3818
1126,I told you biden would be worse then trump,0,0.307,0.693,0.0,-0.4767
1127,Isn't this vaccine leadership great?,0,0.0,0.494,0.506,0.6249
1128,"In push for woke ‘equity,’ Biden abandons equality",0,0.247,0.753,0.0,-0.3182
1129,"37,267 Covid-19 Deaths under Biden.",0,0.0,1.0,0.0,0.0
1130,"Biden Admin Keeps Pressure on Putin, Blasts 'Harsh Tactics' Against Pro-Navalny Protesters",0,0.438,0.562,0.0,-0.7184
1131,GOP lawmakers urge Biden to meet with them on virus relief,0,0.0,0.763,0.237,0.4767
1132,Biden kills Trump plan on opioid-treatment prescriptions,0,0.368,0.632,0.0,-0.5423
1133,‘A President is Not a King’ – Attorneys General Blast Joe Biden For Signing Record Number of Executive Orders in First Week in Office,0,0.0,0.942,0.058,0.0772
1134,Biden approves $230m for Covid home test kits that take 15 minutes and are 95% accurate,0,0.0,0.847,0.153,0.4019
1135,10% for the Big Guy.,0,0.0,1.0,0.0,0.0
1136,Anybody else find it super-weird how Trump has TOTALLY disappeared from the news??,0,0.215,0.785,0.0,-0.5083
1137,Biden Tells Federal Bureaucrats To Approve Regulations With Benefits That Are 'Impossible To Quantify',0,0.0,0.833,0.167,0.3818
1138,California Labor Secretary Promoted to Biden Administration After Overseeing Massive COVID Fraud Scandal,0,0.344,0.513,0.144,-0.5994
1139,"It is much easier to fool someone, than to convince them they have been fooled.",0,0.258,0.516,0.225,-0.1779
1140,Joe Biden Is A Rapist,0,0.62,0.38,0.0,-0.7096
1141,Don't Let Biden Sink Troops Back Into the Afghanistan Quagmire,0,0.0,1.0,0.0,0.0
1142,45 Executive Orders in 2 Weeks,0,0.0,1.0,0.0,0.0
1143,Will Libertarians be classified as “domestic terrorists” ?,0,0.0,0.845,0.155,0.0258
1144,"""Joe Biden is Luciferian"" — Inauguration Day Coverage at Trump's House in Florida",0,0.0,1.0,0.0,0.0
1145,"Biden calls Democrats, urges big COVID-19 relief bill",0,0.0,0.693,0.307,0.4767
1146,Biden signs executive orders on immigration as Homeland Security chief sworn in,0,0.0,0.821,0.179,0.34
1147,"ICE defies Biden, deports El Paso massacre witness, hundreds of others - interesting test to see how Biden handles the left over Trump loyalists.",0,0.0,0.814,0.186,0.5859
1148,"Hundreds deported under Biden, including witness to massacre",0,0.0,1.0,0.0,0.0
1149,Biden is failing on Covid by the standards he set as a candidate,0,0.231,0.769,0.0,-0.5106
1150,Dictator Biden Signs Three Executive Orders Aimed at ‘Reforming US Immigration System’ – Refuses to Answer Questions From Reporters,0,0.0,1.0,0.0,0.0
1151,Biden states family will not be involved in foreign policy after having family involved in foreign policy,0,0.0,1.0,0.0,0.0
1152,"No, Biden Can't Save Us With a 'Reality Czar.' It's peak season for terrible ideas from journalists, academics, and politicians about how to combat disinformation and extremism.",0,0.319,0.681,0.0,-0.8529
1153,NY Times faces backlash for report urging Biden admin to appoint 'reality czar' to combat 'disinformation',0,0.138,0.862,0.0,-0.34
1154,Joe Biden could destroy the legal marijuana market,0,0.318,0.545,0.136,-0.4588
1155,Biden has been in office for 15 days. Kids still in cages. Actually opened a closed down cage and filled it with teens.,0,0.0,1.0,0.0,0.0
1156,Joe Biden is a fake Catholic. His abortion stance is grounds for excommunicated!,0,0.236,0.764,0.0,-0.5255
1157,Biden to end support for Saudi-led offensive operations in Yemen,0,0.219,0.584,0.197,-0.0772
1158,Biden to end US support for Saudi-led offensive in Yemen,0,0.219,0.584,0.197,-0.0772
1159,Trans Student Athletes -- Rand Paul Presses Biden Education Nominee: 'You Seem to Be Afraid to Answer',0,0.0,1.0,0.0,0.0
1160,I feel like the bad public policy from the left has been dialled up to 11 since Joe Biden took office. Not that it was all that great under Trump.,0,0.097,0.72,0.183,0.4767
1161,South Dakota Republican Bill Seeks to Nullify Biden Executive Orders,0,0.0,1.0,0.0,0.0
1162,Biden Justice Department Pick Opposed Enforcing Civil Rights Laws Against Blacks,0,0.0,0.746,0.254,0.5267
1163,Was Trump that terrible? And is Biden better? [Serious],0,0.259,0.524,0.217,-0.1431
1164,Biden Signals Retreat From Nonsensical Minimum Wage Hike in COVID-19 Relief Bill,0,0.0,0.671,0.329,0.5994
1165,Missouri lawmakers race to be first to ‘nullify’ federal gun laws imposed by Biden administration,0,0.222,0.778,0.0,-0.4019
1166,Why is Biden Playing Dictator? How Many EO's has he signed?,0,0.0,0.822,0.178,0.2869
1167,Biden Oversees Dramatic Increase In Wastewater Treatment!!,0,0.0,0.675,0.325,0.4374
1168,Will Biden decriminalize marijuana?,0,0.0,1.0,0.0,0.0
1169,Biden DOJ to continue to seek Assange extradition,0,0.0,1.0,0.0,0.0
1170,Have Kids? Mitt Romney and Joe Biden Want the Government To Pay You Thousands Every Year,0,0.084,0.838,0.078,-0.0258
1171,GOP Rip Biden for Withdrawing Rule on Chinese Propaganda,0,0.2,0.8,0.0,-0.25
1172,Biden announces new Pentagon China task force,0,0.0,1.0,0.0,0.0
1173,Gun control advocates ‘confident’ on executive action from Biden after White House meeting,0,0.167,0.833,0.0,-0.34
1174,BIDEN IS NOT MY PRESIDENT,0,0.0,1.0,0.0,0.0
1175,My Thoughts on Nuclear Weapons/Foreign Policy,0,0.0,1.0,0.0,0.0
1176,"At Pentagon, Biden vows to end wars, put diplomacy first, and use force as a last resort",0,0.194,0.806,0.0,-0.5574
1177,Biden and Yellen brush aside inflation warnings in pursuing $1.9 trillion plan for full employment,0,0.136,0.864,0.0,-0.296
1178,Biden formally terminates national emergency declaration on US-Mexico border that Trump used to pay for wall,0,0.222,0.778,0.0,-0.4588
1179,Did Trump INCITE Violence?,0,0.577,0.423,0.0,-0.6249
1180,Biden should stick to Afghanistan withdrawal timetable,0,0.0,0.845,0.155,0.0258
1181,Libertarians and Republicans are United Against the Maltreatment of Uighurs in China. When Will the Democrats Join us?,0,0.0,0.711,0.289,0.6249
1182,‘That Would Kill Us:’ US Movie Theater Owners Sound Alarm on Biden WH’s $15 Minimum Wage Hike Plan,0,0.307,0.693,0.0,-0.7964
1183,The Democratic Party is Antithetical to Accountability.,0,0.0,0.69,0.31,0.4019
1184,Prominent economists warn Biden risks inflation with $1.9 trillion recovery package,0,0.254,0.58,0.167,-0.0516
1185,Biden to begin admitting migrants forced by Trump to wait in Mexico,0,0.214,0.786,0.0,-0.4588
1186,Biden Admin. Relaunches ‘Catch and Release’ as Illegal Border Crossings Return to ‘Crisis’ Levels,0,0.217,0.783,0.0,-0.5574
1187,Biden launches review aimed at closing Guantanamo Bay detention camp,0,0.217,0.783,0.0,-0.3612
1188,Biden Is Still Separating Families at the Border. Where Is the Media Outrage?,0,0.216,0.784,0.0,-0.5106
1189,Democrats vs Republicans in this sub?,0,0.0,1.0,0.0,0.0
1190,"Mom SHOCKED and super mad at BIDEN’s EO removing price controls on Insulin, 320 dollars for a box of insulin after a coupon. Biden really screwed people over, corrupt in the pocket of big pharma.",0,0.228,0.68,0.091,-0.7028
1191,This Gun Shop Says It Won't Do Business With Biden Voters,0,0.194,0.806,0.0,-0.34
1192,Libertarians support the rights of landlords to racially and sexually discriminate?,0,0.0,0.703,0.297,0.4215
1193,Libertarians support the rights of landlords to racially and sexually discriminate?,0,0.0,0.703,0.297,0.4215
1194,Libertarians are terrorists according to Biden,0,0.446,0.435,0.12,-0.6124
1195,I look to this sub as a significant source of critical thought against the Biden administration,0,0.143,0.745,0.112,-0.128
1196,Economists Slam Biden Stimulus as ‘Economically Unjustified’ Plan That 'Incentivizes Unemployment',0,0.379,0.621,0.0,-0.6705
1197,Can anyone explain why Biden wants to put travel restrictions on Florida despite NY and NJ having the highest deaths per capita?,0,0.0,1.0,0.0,0.0
1198,This Gun Shop Says It Won't Do Business With Biden Voters,0,0.194,0.806,0.0,-0.34
1199,Biden administration files appeal pressing for Assange extradition,0,0.0,1.0,0.0,0.0
1200,Where to draw the line on denial of business?,0,0.0,1.0,0.0,0.0
1201,US government appeals UK ruling against Julian Assange's extradition | Justice department confirms Joe Biden intends to have WikiLeak’s co-founder stand trial in US,0,0.0,0.866,0.134,0.5267
1202,"White House aide suspended for only 1 week after making derogatory and misogynistic comments, Biden previously stated that conduct would not be tolerated",0,0.129,0.871,0.0,-0.4767
1203,Biden reaches another milestone is his coronavirus battle with Trump...,0,0.22,0.678,0.102,-0.34
1204,What conspiracy theories do you believe are true?,0,0.279,0.492,0.23,-0.1531
1205,Civil war is probably coming,0,0.494,0.506,0.0,-0.5994
1206,To what extent has our government overreacted to the pandemic?,0,0.231,0.769,0.0,-0.4019
